category,num,url,text
battlegrounds hack,23,https://groups.google.com/g/garena-free-fire-battlegrounds-cheats-and-hack/c/9SGGHNmSfy0,Free Fire Battlegrounds Hack is here to the rescue. It allows you to add unlimited Diamonds to your wallet with ease. Add unlimited amount of Diamonds and use these hacks to get your pro game on! You would be the best with our gaming hacks diamond generator. ONLINE HACK V1 ONLINE HACK V2 ONLINE HACK V3 Free Fire Battlegrounds Hack Features
battlegrounds hack,24,https://gamefaqs.gamespot.com/pc/470395-star-wars-galactic-battlegrounds/cheats,"to Garena Free Fire Battlegrounds Cheats and Hack. Bang minta diskon. Message has been deleted. Message has been deleted. johnpi...@gmail.com. unread, Nov 22, 2018, 7:21:19 AM 11/22/18 ..."
battlegrounds hack,25,https://www.iwantcheats.net/battlefield-v-hacks-bf5-cheats/,"One way to view this section is to use the ''SimonSays'' cheat, which makes you Simon, The Killer Ewok. After doing this, you will see Young Obi-Wan and the Captain, both from Episode I. If you complete the new mission objectives, you will find Qui-Gon Jinn, Queen Amidala, Young Skywalker, and more."
battlegrounds hack,26,https://www.cheatcc.com/xboxone/wwe2kbattlegroundscheatscodes.html,"Battlefield V Hacks Download. We just updated our game code and the new BFV Firestorm Hacks have been released to our subscribers! That's right the Battlefield V Hacks are online now, our team got our hands on the BFV alpha, so we already made the full BF5 hack. The full game was just released (November 10th) to anyone who got the Deluxe ..."
battlegrounds hack,27,https://www.pockettactics.com/hearthstone/battlegrounds-mobile,"The best place to get cheats, codes, cheat codes, walkthrough, guide, FAQ, unlockables, achievements, and secrets for WWE 2K Battlegrounds for Xbox One."
battlegrounds hack,28,https://howtousecheats.com/free-fire-battlegrounds-how-to-hack-cheats/,"Hearthstone Battlegrounds guide: tips, tricks, and cheats From Mechs to Murlocs, we've got the know-how to help you triumph in Hearthstone's auto chess crucible Last year, Blizzard finally decided to wade into the auto chess phenomenon, with their new game mode, Hearthstone Battlegrounds ."
battlegrounds hack,29,https://perfectaim.io/cheats/battlefield-v/,"Also look at Zombie Avengers Online Hack Coins and Diamonds. About Free Fire ??Battlegrounds Hack. Free Fire ??Battlegrounds Cheat (Cheat Codes) - is a promo codes, which you can enter in Android and iOS games, even without Root and without Jailbreak. Note: this cheat codes works only with original games."
battlegrounds hack,30,https://getpocket.com/@snapthatchat/share/4245660,"Experience World War II with the best cheats around featuring deadly aimbot and precise ESP. Our Battlefield V cheat includes fully customizable aimbot, 2D radar and a clean ESP. Unlike other aimbots, our Battlefield V aimbot is humanized and you can use it without being worried about FairFight catching you. Release date: 10.11.2018."
PUBG bot,1,https://pubglookup.com/bots-in-pubg,"PUBG Lookup BOT data. Match reports provide detailed information on PUBG BOTS in your match including number of BOTS, percentage of BOTS, leaderboard rankings for BOTS, and the number of BOT kills you got in the match.."
PUBG bot,2,https://chatbotslife.com/5-great-discord-bots-for-pubg-e458b9c06e9e,"PUBG-Tracker Prefix: / PUBG-Tracker is a robust and valuable Discord bot for anybody serious about PUBG ??if you're willing to shell out a few bucks for it. While the free version offers only rudimentary play stats for the TPP and FPP modes of PUBG, for as little as $4 a month (Small Plan ??covers 100 users) you'll get access to a suite of tools designed to associate players' in-game ..."
PUBG bot,3,https://www.ggrecon.com/articles/pubg-is-infected-with-bots,"PUBG Corp, unfortunately, has already stated they plan to add bots to PC also, meaning soon, nowhere in the PUBG world will be safe from the bot invasion. Images via PUBG Corp. Advertisement. Trending. PUBG. PUBG is Infected with Bots. PUBG. PUBG Mobile Adds Godzilla Vs Kong In Latest Update."
PUBG bot,4,https://screenrant.com/pubg-playerunknowns-battlegrounds-patch-bots-training-details-practice/,"Related: PUBG's Anniversary Skins Are The Opposite Of Good Camouflage Now, according a a message from the developers posted to the official PUBG website, it looks like even more changes are coming to the game, this time in the form of AI bot players. Because, as the developer states, ""we're seeing more often that many newer players are being eliminated early with no kills - and oftentimes with ..."
PUBG bot,5,https://techsable.com/pubg-mobile-bots/,"Mostly the bot with DP gun can be dangerous sometimes, I will tell you how to identify the bots in PUBG Mobile. Also, you can't forget the benefits of a PUBG bot, a lot easier to kill but gives you a lot of loot and sometimes gives you kar98 sniper with 8x scope. I am going to show you the 5 Most Important tips to identify a PUBG Mobile Bot."
PUBG bot,6,https://www.techradar.com/uk/news/pubg-is-dying-how-bots-threaten-to-destroy-playerunknowns-battlegrounds,"Interestingly, the news of PUBG's bot invasion was revealed just a few days before Google announced that the game was coming to Stadia, its struggling streaming platform. And that makes perfect ..."
PUBG bot,7,https://www.engadget.com/pubg-adds-bots-to-pc-matches-104625573.html,"PUBG wants to give new players a break. With Update 7.2 the game will see the introduction of bots to PC servers designed to help newbies hone their skills, gain a bit of confidence and start ..."
PUBG bot,8,https://www.pcgamesn.com/playerunknowns-battlegrounds/pubg-bots-update-71,"Developer PUBG Corp's announced it'll be bringing bots to the game in the PUBG 7.1 update. In a dev letter on the multiplayer game's site (via The Loadout), lead project manager Joon H. Choi ..."
PUBG bot,9,https://www.quora.com/Where-do-PUBG-mobile-bots-spawn-location?share=1,"Bots in PUBGM don't really have a specific place to spawn. However, beside Pochinki , beyond the yellow grassed farm ( Two barn houses and a shack ) many bots appear at the beginning of the match. Otherwise, bots appear wherever there is an on-goi..."
PUBG bot,10,https://www.reddit.com/r/PUBG/comments/hdyvm8/bots/,"As a new player to PUBG (1.5 months in), my buddies and I all started playing right as BOTS were introduced. We spent the first month playing exclusively Public matches, and knew (thanks PUBGLookup) that on average there would be between 8 - 20 real humans per round."
PUBG bot,11,https://www.pcgamer.com/bots-and-ranked-matches-have-arrived-in-pubg/,"PUBG Corp acknowledged that bots are a ""controversial"" feature, and so far the addition has not exactly been welcomed with open arms. You can check out the 7.2 update now. Take a look at the patch ..."
PUBG bot,12,https://top.gg/tag/pubg,"Pubg Mobile the discord bot for all Pubg Mobile lovers Game, PUBG. View Invite. 10 ONLINE N/A aricdw TÃ¼rkÃ§e, ekonomi ve daha fazlasÄ±nÄ± iÃ§eren bot aricdw! Turkish, Economy. View Invite. 7 ONLINE N/A RahSavage Rahsavage Bot. SunucularÄ±nÄ±zÄ±n Adaletini GÃ¼zelliÄŸini ÅžÄ±klÄ±ÄŸÄ±nÄ± YansÄ±tÄ±r! ..."
PUBG bot,13,https://comicbook.com/gaming/news/pubg-update-ps4-xbox-one-bots-ratio/,PUBG Corp. announced the change for bots in the latest dev letter addressing the state of the game on consoles. An explanation of how the game's bots system worked previously was followed with ...
PUBG bot,14,https://github.com/ClintOxx/PUBG-Battlepoint-FarmBot,AfK-Farm-Bot. Bot/script for Playerunknown Battlegrounds (PUBG) that AFK farms battlepoints(bp) The bot no longer works as of April 2018. I rolled back the repo to my last commmit and I am archiving the repo since no further changes will be made. It was a fun ride and I hope everyone got a lot of BP out of it.
PUBG bot,15,https://pubg.report/,"We've found an easy way to turn PUBG Report into an Android app. The app is exactly the same as the website, but launchable from your homescreen (and reviewable wink wink). Unfortunately this method is not yet possible on iOS. As an alternative you can add PUBG Report to your home screen to get a similar experience."
PUBG bot,16,https://top.gg/bot/611054547112034304,Pubg Mobile the discord bot for all Pubg Mobile lovers
PUBG bot,17,https://www.sportskeeda.com/esports/pubg-guide-what-are-bots-in-pubg-mobile,"How to Identify a bot in PUBG Mobile? Bots usually have unique clothing and good loot weapons. After killing the bot, you can identify if it is a Bot or not by merely looking at the name."
PUBG bot,18,https://www.pubg.com/2020/04/24/console-dev-letter-bots/,"PUBG players engage in firefights across all sorts of distances - from clearing out buildings to those sweet long-range Kar98k headshots. Whatever the distance is, a crucial factor that makes shooting in PUBG so fun is the bullet physics, and we wanted to incorporate that into the bots' shooting as well."
PUBG bot,19,https://www.sportskeeda.com/esports/how-to-spot-and-kill-more-bots-in-pubg-mobile,"A new bot added in PUBG Mobile gives more damage to players. Bots in PUBG Mobile are generally very weak but they have gradually improved. With every update, the developers have made them stronger."
PUBG bot,20,http://fullformplanets.com/how-to-attract-bots-in-pubg-mobile/,"So, instead you can follow any bot type gunshots. Because only 1% players do bot scams. If 2 bots are fighting and one bot is knocked. Than try to kill knocked bot first because it'll also give you a kill bonus of knocked bot. How to get more bots in Pubg Mobile Asia. So, For this reward you'll have to play with low tier players."
PUBG bot,21,https://pubggfx.com/pubg-mobile-aimbot/,"The pubg mobile aimbot has great liking because it is available for both Android as well as iOS. One downside of this mobile hack is that it has a greater risk of the player being banned. So, if you use this mobile hack then have to respect your fellow players otherwise they will identify you and you will be banned in this game."
PUBG bot,22,https://gamingonphone.com/guides/pubg-mobile-how-to-enter-bot-lobby/,"Bot lobby in PUBG Mobile is a great way to push rank and increase a player's K/D or K/M ratio.Basically, Bot lobby is a battle royale match lobby where the player is the only real player, and the remaining players are bots or AI players, they are not real players, that's why it is effortless to spot them or kill them. It is also a great way to complete Royale Pass missions."
PUBG bot,23,https://gurugamer.com/mobile-games/how-to-find-bots-in-pubg-mobile-methods-to-identify-ai-players-at-first-glance-and-how-to-eliminate-them-10089,"How to identify a bot in PUBG Mobile: They have a lot of great items in their crate after dead. Bots usually behave in a very predictable pattern - with PUBG Mobile being such a chaotic fighting game, they would stick out like a sore thumb. A bot will often more around the map in a very composed and calm manner - on a predetermined patch ..."
PUBG bot,24,https://www.pubgsites.com/best-pubg-trading-sites,"Using a PUBG Trading Bot Site is the easiest and most efficient way of trading your PUBG skins. Most Trading Bots usually have a 2-5% commission on all trades, but this is without a doubt worth it. With a trading bot you will have your new skins in your inventory in matter of seconds after making a trade, fast and easy!"
PUBG bot,25,https://realsport101.com/mobile-games/pubg-mobile-season-12-release-date-skins-vehicle-weapons-leaks-bots-how-to-spot-exploit-ai-enemies-cosmetics-royale-pass-india/,"AI enemies in PUBG Mobile don't carry big banners saying ""I'm a bot"", but they can be pretty easy to suss out. Bot movements are always predictable and calm. They don't cross open areas in a zig ..."
PUBG bot,26,https://www.pcgamesn.com/playerunknowns-battlegrounds/bot-nerf,"Anyway, here are some murderous PUBG bots in action: Bot with aim/wallhacks hipfire deletes 2 players before they can even shoot back - Bluehole definitely making the game fun for its dwindling ..."
PUBG bot,27,https://www.gamesradar.com/pubg-adds-bots-to-help-new-players-not-just-die-immediately/,Developer PUBG Corp added bots to the influential battle royale game in Update 7.1 last week. The studio outlined the reason behind its decision and how it's making bots work in a letter to the ...
PUBG bot,28,https://gamerant.com/pubg-update-bot-frequency-october-2020/,"PUBG Update Changes Bot Frequency. PUBG announces that it is adjusting the frequency at which bots are added to fill matchmaking queues, suggesting the game is doing well."
PUBG cheat,1,https://rivalcheats.com/pubg-cheats/,"The PUBG cheats we offer provide players with a huge advantage which makes them completely unstoppable. This is the reason why so many players tend to use our PUBG hacks. Game Title Cheat Features: Aimbot There aren't many things more intense than fights in PUBG, especially during the last minutes of a match. ..."
PUBG cheat,2,https://battlelog.co/pubg-hacks/,"PUBG Cheats with Aimbot, ESP / Wallhack, Radar hack, and more. If you are looking for undetected PUBG hacks with aimbot, ESP and radar hack, you have come to the right place! At Battlelog, we offer the industry's best and safest PUBG hacks."
PUBG cheat,3,https://www.skycheats.com/pubg-hacks-cheats-and-aimbot-2020/,"This PUBG cheat, however, eliminates the recoil completely and holds your gun steady from one shot to the next. The recoil cheat is pretty difficult to detect hence it rarely attracts bans from the PUBG anti-cheat time like some of the more popular PUBG hacks and cheats."
PUBG cheat,4,https://www.iwantcheats.net/pubg-hacks/,"The PUBG Cheat shows you every player in the game with ESP or glowing boxes. You'll find items scattered in buildings and houses, and they have a slight glow to them. They include melee weapons, food, body armor, first aid kit, and other supplies that would facilitate on the battlefield and improve their chances of survival."
PUBG cheat,5,https://proofcore.io/cheats/pubg/,"Previous Next PUBG Cheat Player ESP: Name, Box, Health, Max. Distance, Weapon Item ESP: Weapon, Grenade, Gear, Medic, Attach, Ammo,"
PUBG cheat,6,https://lavicheats.com/playerunknowns-battlegrounds-hacks-pubg/,"PUBG Hack/Cheat Features Name ESP - PUBG hack ESP Stands for Extra Sensory Perception and is a type of compromise in the game. This enables the user to spectate the game as a third party and one can see the name of every other player anywhere on the map. PUBG Wallhack PUBG wallhack, as the name suggests, helps user to see through the wall."
PUBG cheat,7,https://slatehub.io/pubg-cheats-hacks-aimbots/,"PUBG Cheats, Hacks & Aimbots Requirements. No Cheat or Hack is 100% Undetectable. There will always be risk of an account ban if the Cheat or Hack is detected by the Anti-Cheat Provider. When this happens your account will be banned and we will update the Cheat or Hack to be Undetected again. It's important that you Spoof your HWID every time ..."
PUBG cheat,8,https://www.cheat-god.com/cheats/free-playerunknowns-battlegrounds-cheat-pubg-hack-wallhack-aimbot-pc/,"Each PUBG weapon has a different feel, which is why Players are going to have somewhat of a preference. Some gamers are going to go for the sniper almost immediately, while other gamers will be more keen on finding an automatic weapon. With this PUBG cheat in your pocket, it doesn't matter what kind of rifle that you happen to have - it's ..."
PUBG cheat,9,https://securecheat.xyz/,"Easily get your way in every game using our aimbots, ESP and radar to make sure you're never flanked and always on top of your opponent. Always have the best loot and climb the leaderboard while you're at it! Configurable, Bone Aimbots. Easily knock down your opponents in any game we provide for. 24/7 Fastest support that exists at the moment."
PUBG cheat,10,https://sinkicheat.com/,"PUBGM Accounts Market (19,857 visits to this link) Our trusted sellers sell their sexy looking PUBGM account that has cool stuffs in it."
PUBG cheat,11,https://procheat.store/cheat-for-pubg-mobile/,"PUBG mobile cheat with an option of 1 hour free trial is now available on our website. This cheat includes 3 program versions with reduced features, variation in prices allows you not to overpay for unnecessary features. Support for PUBG mobile tencent and Gameloop cheats is connected via emulator and only works on PC."
PUBG cheat,12,https://txlcheats.com/,TXL Cheats - PUBG Cheat. We offer the best undetected PUBG Cheat. Our cheat comes with ESP and is complete streamproof. We offer the most secure Playerunknown's Battlegrounds Cheat - its undetected since release. With our Playerunknown's Battlegrounds Hack you never lose anymore games. Now its time to get our strong PUBG Hacks.
PUBG cheat,13,https://akcheat.com/,"AKCheat is a best place for all free crack tools and software, we will share many time of hack,bypass & script for Pubg Mobile emulators! 1."
PUBG cheat,14,https://www.elitepvpers.com/forum/playerunknowns-battlegrounds/,"PlayerUnknown's Battlegrounds Hacks, Cheats & Aimbots. Download or share your PlayerUnknown's Battlegrounds hack at world's leading forum for all kind of PlayerUnknown's Battlegrounds hacks, cheats and aimbots. Here you will find a list of discussions in the PlayerUnknown's Battlegrounds forum at the Popular Games category. Undetected cheat ..."
PUBG cheat,15,https://aimclub.io/pubg-cheats-hacks-esp-aimbot/,PUBG Cheats & Hacks from AimClub.io. PUBG is a battle royale game similar to Fortnite with over 60 million PC players and over 600 million downloads for PUBG mobile. Our PUBG Cheats will allow you to dominate all other squads and ensure you become the Battle Royale Winner. You'll be able to find all the items and weapons you'll need to ...
PUBG cheat,16,https://www.gamesradar.com/pubg-cheats-explained/,"Players have been using PUBG cheats since the days of early access, and this is a big issue for the developers as they try to maintain fairness and balance for all players in the online battle royale."
PUBG cheat,17,https://www.cheatcc.com/xboxone/playerunknownsbattlegroundscheatscodes.html,"The best place to get cheats, codes, cheat codes, walkthrough, guide, FAQ, unlockables, achievements, and secrets for PlayerUnknown's Battlegrounds (PUBG) for Xbox One."
PUBG cheat,18,https://invisioncheats.com/cheats/pubg-cheat-undetected-pubg-hack.1/,"PUBG Cheat | Undetected PUBG Hack. Seller Synex; Creation date Jan 3, 2021; Get this amazing undetected PUBG Cheat with full ESP. Streamproof on every tool! Store. Cheats. unknown.jpg. 354.2 KB Views: 1,258. If you want to pay through PayPal, simply create a ticket on the #open ..."
PUBG cheat,19,https://www.pubgpclite.com/pubg-mobile-cheats-hacks/,"Hello PUBG players, We received so many queries for PUBG Mobile Hack and PUBG Mobile Cheat Codes.People want to know about PUBG Hack free and How to hack the PUBG game. I am going to tell you about it in brief, keep reading. PUBG mobile is now becoming popular more day by day."
PUBG cheat,20,https://rcheats.net/pubg-hacks/,"Undetected PUBG Hacks for Steam, Kakao, Gameloop and Lite versions of PUBG. Get access and start dominate right now! Safe aimbot and esp cheats."
PUBG cheat,21,https://gamepron.com/pubg-hacks-cheats-aimbot-wallhack/,"Our PUBG Hacks are completely undetected, meaning your account isn't going to be at risk while cheating. Most providers will say they have anti-cheat protection and you end up getting banned regardless, but we truly do offer 100% undetected cheats. Not only that, but our cheats are available on an exclusive basis."
PUBG cheat,22,https://www.privatecheatz.com/playerunknowns-battlegrounds-hack/,"Hacks/Cheats. With Aimbot, ESP/Wallhack, And Radar Hack. We just added our PUBG Rage hack, if you want to full auto from across the map and get headshot after headshot then this product is the right pick for you. With full player & loot esp & Aim Prediction. Starting at just $10 try it today!"
PUBG cheat,23,https://veterancheats.com/store/category/2-pubg/,Make sure to have the latest windows update for the cheats to work. The best version is 1909 because all cheats work with this windows version. We are one of the biggest cheats distributors/providers for all games that are listed on the right side. Our discord is always available for support/questions you might have.
PUBG cheat,24,https://hackgame-tools.com/cheats/free-playerunknowns-battlegrounds-cheat-pubg-hack-wallhack-aimbot-pc/,"DOWNLOAD Startup Pack. DOWNLOAD Last 2021 Script. Our PUBG hack are completely undetected so there is no risk to your account. If you're already familiar with cheats and such, then this won't be a very big surprise to you. PlayerUnknown's Battlegrounds is the newest rendition of shooter games to be considered, and it's much better than ..."
PUBG cheat,25,https://www.invisioncheats.com/,"InvisionCheats - Valorant Cheats & more. InvisionCheats is a cheat provider which offers different cheats. We offer Aimbot, ESP, Wallhacks and other features for Valorant, Apex, R6S, PUBG and other games!"
PUBG cheat,26,https://www.vice.com/en/article/93ywj3/inside-the-worlds-largest-video-game-cheating-empire,"The cheat-making group known as ""Chicken Drumstick"" made more than $70 million selling cheats for PUBG Mobile. This is the story of its rise and fall."
PUBG cheat,27,https://lavicheats.com/,"We provide the best and undetected game cheats. Get PUBG hacks and cheats, PUBG mobile cheats, Apex Legends cheats, R6 hacks at lavicheats"
PUBG cheat,28,https://www.cheto.io/en/store/product/1/pubg-mobile-cheat,"The PUBG Mobile Cheat by Cheto is the most advanced PUBG Mobile Hack to date, leaving everything else in the dust. Works both on iOS and iPadOS and NO JAILBREAK is required."
PUBG cheat,29,https://www.noypigeeks.com/gaming/pubg-cheats-hacks/,"Brendan Greene (aka PlayerUnknown), the developer of PUBG, agreed with anti-cheat provider BattlEye that 99% of the cheaters come from China.There are a lot of cheating cases in different countries from all over the world, but the majority hail from China, where cheating is a bit more acceptable and is even advertised by some cheat developers."
PUBG exploit,1,https://www.pcgamesn.com/playerunknowns-battlegrounds/pubg-exploit-invisible-no-circle-damage,"Apparent PUBG exploit makes players invisible and immune to circle damage Coming in second place in PlayerUnknown's Battlegrounds is always frustrating, but it's much worse when you hit the ..."
PUBG exploit,2,https://www.pcgamesn.com/playerunknowns-battlegrounds/pubg-sanhok-exploit,"PUBG's Sanhok map has an exploit that lets you hide underground. The latest map to be added to PlayerUnknown's Battlegrounds, Sanhok, contains a pretty major glitch. And not the kind of glitch ..."
PUBG exploit,3,https://dontfeedthegamers.com/pubg-exploit-blue-circle/,
PUBG exploit,4,https://www.elitepvpers.com/forum/pubg-hacks-bots-cheats-exploits/,"In regards to the latest PUBG exploit to be discovered, some have managed to find a way to avoid damage caused by the dreaded blue circle of death. For those not in the know, PlayerUnknown's Battlegrounds features a terrifying circle that closes in on remaining players. When up close and personal, the circle is more like a giant wall of ..."
PUBG exploit,5,https://comicbook.com/gaming/news/pubg-sanhok-glitch-exploit/,"Get or release your PUBG Hacks, Bots, Cheats & Exploits here. [no questions] Here you will find a list of discussions in the PUBG Hacks, Bots, Cheats & Exploits forum at the PlayerUnknown's Battlegrounds category."
PUBG exploit,6,https://battlelog.co/pubg-hacks/,"PUBG Exploit Lets Players Rack Up Some Cheap Kills. By Tanner Dedmon - July 1, 2018 10:33 am EDT. Share 0 Comments. 0; There's a glitch in PlayerUnknown's Battlegrounds that puts players under ..."
PUBG exploit,7,http://gamingexploits.com/pubg-mobile-out-of-the-map-glitch/,"PUBG Aimbot. Most of our Playerunknown Battlegrounds hacks have aimbot. The aimbots we offer have aim prediction and bullet drop prediction, which makes even long shots at running targets like stealing candy from a child: Easy. This, alongside our wallhack, creates an easy way of killing enemies, while looking legit."
PUBG exploit,8,https://www.cheat-god.com/cheats/free-playerunknowns-battlegrounds-cheat-pubg-hack-wallhack-aimbot-pc/,"PUBG Mobile is a polished game when it comes to textures, bugs, exploits and glitches. However, we have a glitch that allows players to jump out of the map in the Team Deathmatch game mode. This takes place on the map 'Warehouse' and can be quite difficult to do solo, so you will need a buddy to help you."
PUBG exploit,9,https://www.pcgamer.com/another-pubg-streamer-has-been-banned-this-time-for-taking-advantage-of-a-glitch/,"With this PUBG exploit, you are 100% protected in regard to BattlEye. Video Proof and Spectator Protection are always readily available with every single hack provided here! VAC BattlEye Video Proof Spectator Protection"
PUBG exploit,10,https://www.reddit.com/r/PUBGXboxOne/comments/9ms0im/for_those_of_you_who_claim_xbox_cant_be_hacked_i/,"Even though Destiny apparently didn't do anything to trigger the glitch, he obviously took advantage of it, which is a hard ""no"" in the PUBG rules of conduct: ""Do not exploit bugs or glitches: If ..."
PUBG exploit,11,https://variety.com/2018/gaming/news/pubg-sanhok-exploit-1202863485/,"4.) No memory exploit has been found. A memory exploit would be a buffer overflow or under run that would let one app rewrite another apps memory. Since Windows uses DEP (which randomizes where data is stored in RAM when launched. it is different every time) to protect against this, I would assume the Xbox does also."
