category,num,url,text
battlegrounds bot,1,https://discordbotlist.com/bots/battlegrounds,"BattleGrounds is a fun bot where you can find and buy boxes and unbox them to get guns, ammunition and other utilities. Attack your friends and loot their death crates to open even more boxes and climb up the ladder. Complete missions to get exciting rewards.There is even a market where you can trade items from fellow users."
battlegrounds bot,2,https://botsfordiscord.com/bot/759432311086383114,"BattleGrounds is a fun bot where you can find and buy boxes and unbox them to get guns, ammunition and other utilities. Attack your friends and loot their death crates to open even more boxes and climb up the ladder. Complete missions to get exciting rewards.There is even a market where you can trade items from fellow users."
battlegrounds bot,3,https://www.youtube.com/watch?v=yzBcvDGxNwk,Hi guys! In this video we're going to do BATTLEGROUND QUEST BOT! Easy XP and Gold bot! Instructions:1. Download Grimoire 3.8+ and the bot.2. Open the bot a...
battlegrounds bot,4,https://wrobot.eu/,
battlegrounds bot,5,https://wowbgbot.wordpress.com/category/world-of-warcraft-battleground-bot/,"Earn honor points using this bot in PVP battlegrounds including a queueing system. Automaton. Botting without a profile. WRobot finds a path for you and will gather, earn you experience, and even pet battle. Schedule. Even when you are away this bot can be scheduled to use it's products. You can schedule multiple products and durations."
battlegrounds bot,6,https://top.gg/bot/442019408446095370,4. Download the bot and follow the setup instructions. 5. Start WoW and the bot. 6. Watch the bot for a couple of battlegrounds and make sure it's working okay. 7. Leave and comeback in an hour to so and make sure everything is okay. If you are full of honor and conquest points make sure to buy some pvp gear and start the bot again.
battlegrounds bot,7,https://www.youtube.com/watch?v=PGUICNZ8ljs,"PLAYERUNKNOWN'S BATTLEGROUNDS Bot, which can give you information about your match, can send statistics about your match everytime when the match is finished. Server shards: steam"
battlegrounds bot,8,https://battlebots.com/,Gold Fast BOTBattleground BOTDagurasu BOTS_____Mediafire Download (gbot):https://hastebin.com/raw...
battlegrounds bot,9,https://github.com/topics/battlegrounds,"The bot builders and crew fell in love with Kirk, and we dubbed him ""horse head dude."" Unfortunately, Kirk has gone missing and his family are desperately trying to find him. He disappeared June 3rd from San Antonio, Texas. Kirk went out riding his motorcycle and never showed up for his family gaming night. Please click on the Go Fund Me link ..."
battlegrounds bot,10,https://hearthstone.fandom.com/wiki/Deflect-o-Bot,"A Discord bot providing the most famous quotes of Bob from Hearthstone's Battlegrounds game mode. bot blizzard discord hearthstone discord-bot python3 discord-py battlegrounds Updated Dec 19, 2020"
battlegrounds bot,11,https://screenrant.com/pubg-playerunknowns-battlegrounds-patch-bots-training-details-practice/,"Deflect-o-Bot is a Tier 3 minion in the Battlegrounds game mode.. Strategy [edit | edit source]. Like its predecessor Cobalt Guardian, Deflect-o-Bot is the cornerstone of Mech, Divine Shield, and sometimes Menagerie and Deathrattle builds.Its ability grants it Divine Shield whenever a Mech is summoned - for this reason, it is best played alongside another Mech, to give it the Shield immediately."
battlegrounds bot,12,https://forums.elderscrollsonline.com/en/discussion/496576/battlegrounds-bots,"It looks like AI-controlled bots are finally coming to PlayerUnknown's BATTLEGROUNDS, according to a developer blog post. PUBG recently launched their seventh season, reintroducing players to the snow map of Vikendi (which now has a working train transit system and a redesigned dinosaur theme park) as well as giving them a semi-new weapon in the form of a Mosin-Nagant sniper rifle."
battlegrounds bot,13,https://www.nme.com/news/gaming-news/player-unknowns-battlegrounds-bots-get-nerfed-in-new-patch-2964918,"Battlegrounds 'bots' Leave a Reply. Ruinhorn @ZOS_GinaBruno @ZOS_JessicaFolsom @ZOS_MattFiror Hello, Are there any plans on tracking 'bots' in BGs: players which can't be kicked, but stand still on base instead doing nothing. They move sometimes to keep themselves online, but spoil ingame process and do not contribute into group success. ..."
battlegrounds bot,14,https://www.pcgamer.com/pubgs-terrifying-bots-have-been-toned-back-down/,PUBG Corporation has released a new update for the battle royale that tames the rampaging bots. On 2 June Player Unknowns Battlegrounds began season 12 and introduced a number of new features. One ...
battlegrounds bot,15,https://www.trueachievements.com/game/PlayerUnknowns-Battlegrounds/walkthrough/4,"PlayerUnknown's Battlegrounds has released an emergency hotfix to tone down the battle royale's killer robot problem.Last month, PUBG's 12.1 update arrived with a few changes aimed at making the ..."
battlegrounds bot,16,https://www.pcgamesn.com/playerunknowns-battlegrounds/pubg-bots,"PlayerUnknown's Battlegrounds Details about Bots. Bots offer new, easier opportunity for Achievements (Valid as of 30/05/2020) Bots are NOT in ranked mode. A recent update has made two different ..."
battlegrounds bot,17,https://github.com/SquarerFive/bf3-bots,"PlayerUnknown's Battlegrounds has been hitting a bit different since the battle royale game's last update. Players were swift to notice that each game has notably fewer bots, which is going ..."
battlegrounds bot,18,https://www.reddit.com/r/Battlefield/comments/nw7svg/battlefield_2042_multiplayer_ai_bots_possibly/,"bf3-bots. AI mod for BF3, this is an attempt to recreate BF2-like bots. This mod is currently in development, some features may not function as intended (such as project export). Released: Version 0.0.4 Main: Version 0.0.45dev Master Branch: Features. AI Teamwork Bots can provide each other ammo or health (when they are at a critical state)."
battlegrounds bot,19,https://www.mpgh.net/forum/showthread.php?t=1143021,Battlefield 2042 Multiplayer AI Bots Possibly Developed by SEED Team. Other. One of my most anticipated features for Battlefield 2042 is the addition of AI bots in the offline multiplayer environment. It's very possible that the AI they have implemented is using the AI tech from EA's SEED team which means it might actually be quite competent to ...
battlegrounds bot,20,https://www.techradar.com/news/pubg-is-dying-how-bots-threaten-to-destroy-playerunknowns-battlegrounds,"BattleGround A-B-C-D-E XP-CP-Gold Bot i recommended to use Carbon, it better than Le Bot ... First : join room ---> /join battleground(a/b/c/d/e) /join battlegrounde ..."
battlegrounds bot,21,https://steamcommunity.com/app/823940/discussions/0/2268069450206823588/,"PUBG has added bots to the PS4, Xbox One, Stadia and PC versions of the game. ... PlayerUnknown's Battlegrounds has been fundamentally ruined by developer PUBG Corporation's baffling decision ..."
battlegrounds bot,22,https://arcadespot.com/game/battle-bots-design-destroy/,Virtual Battlegrounds. ... but no matter what option i pick in the elevator it takes me to the same lobby? is there a way to play with JUST bots? i just want to get the hang of the game a little bit with less pressure. i should note that even selecting private game and entering anything in for game name will still bring me to the public lobby.
battlegrounds bot,23,https://www.ownedcore.com/forums/world-of-warcraft/world-of-warcraft-general/208276-battleground-bot.html,Battle-Bots: Design And Destroy is an action-packed video game released back in 2002 for the Game Boy Advance handheld system. The game is based on the Battle-Bots gameshow and has a similar game mechanic in which the player must take control of a radio-controlled robot and battle on the arena.
battlegrounds bot,24,https://www.tweaktown.com/news/80029/ai-bots-will-ensure-24-7-battlefield-mayhem-in-2042/index.html,"A Free AFK Battleground Bot. By wowregister in forum World of Warcraft Bots and Programs Replies: 68 Last Post: 10-12-2009, 08:46 PM. What I've learned about Battleground Botting. By ayadew in forum World of Warcraft Guides Replies: 2 Last Post: 02-13-2008, 02:35 AM"
battlegrounds bot,25,https://www.pcgamesn.com/playerunknowns-battlegrounds/bot-nerf,EA has a vision with Battlefield 2042: Always-online action that never ends. DICE shares this vision and that's why they're using AI bots to bring '24/7 Battlefield mayhem' to their new shooter ...
battlegrounds bot,26,https://www.vg247.com/2021/06/09/battlefield-2042-all-out-warfare-ai-bots-co-op-pvp-pve/,"PlayerUnknown's Battlegrounds' bots have been a tad strong of late.Over the past week, clips of players getting owned by their new, superior overlords have flooded the battle royale's subreddit."
battlegrounds bot,27,https://hearthstone.fandom.com/wiki/Ysera_(Battlegrounds),"Battlefield 1942, Battlefield Vietnam, Battlefield 2, and Battlefield 2142 all actually allowed players to recreate the chaos of multiplayer with AI bots, but the feature has been MIA since."
battlegrounds bot,28,https://steamcommunity.com/app/578080/discussions/1/135513421439596535/,"See this card on Hearthpwn For the Classic version of Ysera, see Ysera. For the Descent of Dragons version of Ysera, see Ysera, Unleashed. Ysera is a hero that the player can pick in the Battlegrounds game mode. For more information, see Battlegrounds. 1 Hero Power 2 Strategy 3 Gallery 4 Patch changes Offers a reliable way to source dragons from the tavern. If the tavern is frozen, the extra ..."
battlegrounds cheat,1,https://www.ign.com/wikis/star-wars-galactic-battlegrounds/PC_Cheats,"This page contains a list of cheats, codes, Easter eggs, tips, and other secrets for Star Wars Galactic Battlegrounds for PC.If you've discovered a cheat you'd like to add to the page, or have a ..."
battlegrounds cheat,2,https://gamefaqs.gamespot.com/pc/470395-star-wars-galactic-battlegrounds/cheats,"For Star Wars Galactic Battlegrounds on the PC, GameFAQs has 23 cheat codes and secrets."
battlegrounds cheat,3,https://www.gamesradar.com/pubg-cheats-explained/,"PlayerUnknown's Battlegrounds cheats explained. By Mike Stubbs 29 May 2020. Discover the world of PUBG cheats, bot, or hack ... Players have been using PUBG cheats since the days of early access ..."
battlegrounds cheat,4,https://acegameguides.com/battlegrounds-composition-cheatsheet/,"April 2, 2021. This article is meant as a simple overview to use while in-game to guide your compositions in Battlegrounds. While this cheat sheet wasn't originally planned, we decided to create one at the request of multiple people. To find all full-length guides and strategies, take a look at the Compositions page instead."
battlegrounds cheat,5,https://cheatland.net/star-wars-galactic-battlegrounds,"Star Wars: Galactic Battlegrounds Cheats List. Automatically win current scenario. Kill all enemies in scenario. Gain 1000 carbon. Gain 1000 food. Gain 1000 nova. Gain 1000 ore. Allows actions such as building, training units, research, and resource gathering to be completed instantly. Fog of war is removed."
battlegrounds cheat,6,https://x22cheats.com/cheats/playerunknowns-battlegrounds,"PlayerUnknown's Battlegrounds Cheat. PUBG Cheats Our PUBG Cheats are leading in the cheat industry. We offer the best solution for legit, rage or HvH players. Our Aimbot gives you full control over the game, you can rage or play legit like a pro."
battlegrounds cheat,7,https://www.privatecheatz.com/playerunknowns-battlegrounds-hack/,"Hacks/Cheats. With Aimbot, ESP/Wallhack, And Radar Hack. We just added our PUBG Rage hack, if you want to full auto from across the map and get headshot after headshot then this product is the right pick for you. With full player & loot esp & Aim Prediction. Starting at just $10 try it today!"
battlegrounds cheat,8,https://www.supercheats.com/wwe-2k-battlegrounds-cheats-tips,WWE 2K Battlegrounds is an arcade-style fighting game based on professional wrestling. The game features a wide cast of WWE superstars new and old as they compete in outlandish interactive environments around the world in over-the-top combat that leans heavily on cartoon violence.
battlegrounds cheat,9,https://www.elitepvpers.com/forum/playerunknowns-battlegrounds/,"PlayerUnknown's Battlegrounds Hacks, Cheats & Aimbots. Download or share your PlayerUnknown's Battlegrounds hack at world's leading forum for all kind of PlayerUnknown's Battlegrounds hacks, cheats and aimbots. Here you will find a list of discussions in the PlayerUnknown's Battlegrounds forum at the Popular Games category. Undetected cheat ..."
battlegrounds cheat,10,https://www.apocanow.com/cheats/multi/19972/wwe-2k-battlegrounds,Discover cheats and cheat codes for WWE 2K Battlegrounds (PC / PS4 / XBOX ONE / SWITCH): Team Crowd Meter and Opponent Crowd Meter. An avalanche of cheats for you thanks to the trainer of WWE 2K Battlegrounds downloadable on this page! A Trainer is a software that allows you to modify the game safely by adding cheats that did not exist previously.
battlegrounds cheat,11,https://cheatautomation.com/playerunknowns-battlegrounds-hack,"Win more matches than ever before with CheatAutomation's Playerunknown's Battlegrounds cheat! Our stripped down, ESP only cheat gives you the key features you need to take out your opponents and be eating chicken dinner all week! With our player ESP, see the locations of all nearby players, letting you track them down and surprise them, or avoid them while you gear up."
battlegrounds cheat,12,https://aimexcheats.com/pubg-cheat,PLAYERUNKNOWN`S BATTLEGROUNDS CHEAT. Our PUBG Cheat has been released in November 2020. So far we never had any detection. The cheat comes with a lot of function which all are crucial for legit cheating. Our cheat is stream and record proof for any software and streaming plattform. PUBG VISUALS. Our main feature is the ESP which comes for Players.
battlegrounds cheat,13,https://www.pockettactics.com/hearthstone/battlegrounds-mobile,"Hearthstone Battlegrounds guide: tips, tricks, and cheats From Mechs to Murlocs, we've got the know-how to help you triumph in Hearthstone's auto chess crucible Last year, Blizzard finally decided to wade into the auto chess phenomenon, with their new game mode, Hearthstone Battlegrounds ."
battlegrounds cheat,14,https://swgb.heavengames.com/cheats.php,"HeavenGames. Cheats. Cheat codes may be used in single player at any time, and in multiplayer if cheats are enabled. To enter a cheat code, press enter, type the code, and press enter again. Case does not matter. Listed below are all the known cheats. They are split into categories according to game version. Galactic Battlegrounds."
battlegrounds cheat,15,https://lavicheats.com/playerunknowns-battlegrounds-hacks-pubg/,"Playerunknown Battlegrounds Hacks - Why we are Safest Cheats Provider Our developers at Lavicheats have designed metamorphic cheats with signature methods and custom, encrypted code to ensure that they stay undetectable to various anti-cheat software and tools, including BattleEye, VAC, and Xenuine."
battlegrounds cheat,16,https://www.mpgh.net/forum/forumdisplay.php?f=913,"Welcome to MPGH - MultiPlayer Game Hacking, the world's leader in Game Hacks, Game Cheats, Trainers, Combat Arms Hacks & Cheats, Crossfire Hacks & Cheats, WarRock Hacks & Cheats, SoldierFront Hacks & Cheats, Project Blackout Hacks & Cheats, Operation 7 Hacks & Cheats, Blackshot Hacks & Cheats, A.V.A. Hacks & Cheats, Call of Duty Hacks & Cheats, Gunz Hacks & Cheats, Quake LIVE Hacks & Cheats ..."
battlegrounds cheat,17,https://gamecheatcenter.com/free-fire-battlegrounds-cheat-to-get-free-unlimited-diamonds/,"How the Free Fire Battlegrounds Cheat Works. The whole process of accessing the Free Fire Battlegrounds Cheat is very simple. To begin with, just go to this page, Click on 'Online Hack V1' or 'Online Hack V2' or 'Online Hack V3'. As you'll be able to see, you will have to choose an operating system, Android or iOS, in order to ..."
battlegrounds cheat,18,https://swgb.fandom.com/wiki/Cheats,"To activate the cheats, press ENTER during gameplay. Type a cheat from the list below to activate its function: forcebuild - Instant contruction/research forcecarbon - 1,000 Carbon forcefood - 1,000 Food forcenova - 1,000 Nova forceore - 1,000 Ore darkside[2-8] - Destroy enemy. Replace [2-8] with a number to defeat that enemy. The number corresponds with the order in the diplomacy panel ..."
battlegrounds cheat,19,https://hackpubg2018free.blogspot.com/,cheat playerunknown's battlegrounds cheat PUBG hack PUBG hack PUBG free playerunknown's battlegrounds crack playerunknown's battlegrounds hack PUBG TOOL V 1.0 PUBG TOOL V 1.5 PUBG TOOL V 1.7 PUBG TOOL V 2.0 PUBG TOOL V 2.0 beta
battlegrounds cheat,20,https://gbatemp.net/download/wwe-2k-battlegrounds-cheat-file.36633/,"WWE 2K Battlegrounds CHEAT file. v1.6.0.0. After a fight or while loading, disable codes. Otherwise, there could be a crash. Reprinting and upload is forbidden outside GBAtemp ! yitzhaka, Starhatred, felonius and 3 others like this."
battlegrounds cheat,21,https://www.cheatcc.com/ps3/monsterjambattlegroundscheatscodes.html,"The best place to get cheats, codes, cheat codes, walkthrough, guide, FAQ, unlockables, trophies, and secrets for Monster Jam: Battlegrounds for PlayStation 3 (PS3)."
battlegrounds cheat,22,https://www.hack-cheat.org/gfx-tool-for-battlegrounds-new-v18,"GFX Tool for BattleGrounds (NEW) V.18 tricks hints guides reviews promo codes easter eggs and more for android application. Avoid GFX Tool for BattleGrounds (NEW) V.18 hack cheats for your own safety, choose our tips and advices confirmed by pro players, testers and users like you. Ask a question or add answers, watch video tutorials & submit own opinion about this game/app."
battlegrounds cheat,23,https://www.youtube.com/watch?v=QVQmOR12Xz0,"WWE 2K Battlegrounds - ALL UNLOCKABLES & FULL WALKTHROUGH! (All Alt Attires, Royal Rumble Options, Gauntlet Options, Overalls, & More!)... Subscribe For More..."
battlegrounds cheat,24,https://www.cheathappens.com/75730-PC-WWE-2K-Battlegrounds-trainer,"PC Cheats, Cheat Codes and Hints We currently don't have any WWE 2K Battlegrounds cheats, cheat codes or hints for PC . Please check back at a later date for more cheats and codes to be added."
battlegrounds cheat,25,https://battlelog.co/pubg-hacks/,"PUBG Aimbot. Most of our Playerunknown Battlegrounds hacks have aimbot. The aimbots we offer have aim prediction and bullet drop prediction, which makes even long shots at running targets like stealing candy from a child: Easy. This, alongside our wallhack, creates an easy way of killing enemies, while looking legit."
battlegrounds cheat,26,https://www.ign.com/wikis/playerunknowns-battlegrounds/Walkthrough,"IGN's PlayerUnknown's Battlegrounds complete strategy guide and walkthrough will lead you through every step of PlayerUnknown's Battlegrounds from the title screen to the final credits, including ..."
battlegrounds cheat,27,https://www.cheathappens.com/2958-PC-Star_Wars_Galactic_Battlegrounds_Clone_Campaigns_cheats,"1. Star Wars: Galactic Battlegrounds - Clone Campaigns Cheats, Cheat Codes & Hints. May 15, 2002. Cheat Codes. Hit [Enter] and type the desired cheat: Code. Result."
battlegrounds cheat,28,https://www.youtube.com/watch?v=jL_clDkswjY,BATTLEFIELD 1942 Full Game Walkthrough This is BATTLEFIELD 1942 Gameplay Walkthrough that covers Part 1 up until the Final Part of our Full Game Walkthrough ...
battlegrounds cheat,29,https://forum.aimjunkies.com/f124/totally-accurate-battlegrounds-cheat-information-104188/,"Available Cheats and Purchase Information. Totally Accurate Battlegrounds - Cheat Information. Welcome! If this is your first time visiting, click here to register. If you already have an account, log in at the top. Our cheats are available for PC - Windows ONLY! Click here for a list of PC requrements to use our cheats. Thanks: 11."
battlegrounds cheat,30,https://perfectaim.io/cheats/battlefield-v/,"Experience World War II with the best cheats around featuring deadly aimbot and precise ESP. Our Battlefield V cheat includes fully customizable aimbot, 2D radar and a clean ESP. Unlike other aimbots, our Battlefield V aimbot is humanized and you can use it without being worried about FairFight catching you. Release date: 10.11.2018."
battlegrounds exploit,1,https://www.pcgamer.com/hearthstone-battlegrounds-players-are-using-a-windows-firewall-exploit-to-get-extra-turn-time/,Hearthstone Battlegrounds players are using a Windows firewall exploit to get extra turn time By Tim Clark 11 January 2021 High-level players Slysssa and Kripparrian explain the problem and how to ...
battlegrounds exploit,2,https://github.com/Breekys/Hearthstone_Battlegrounds_Skip,
battlegrounds exploit,3,https://www.reddit.com/r/hearthstone/comments/kjpa7d/battlegrounds_exploit_bug_a_player_continuously/,"Hearthstone Battlegrounds Skip A useful tool to skip battles in Hearthstone Battlegrounds ! This tool uses an exploit in Hearthstone Battlegrounds to skip battles. It enables you to disconnect and reconnect quickly from the game, so that when you reconnect, you will be in the recruit phase. How to use ? Work only with Windows. Download HSBGSkip.exe"
battlegrounds exploit,4,https://www.reddit.com/r/hearthstone/comments/dwq96q/hs_battlegrounds_exploit/,"Battlegrounds exploit / bug? A player continuously battled dead players while I was rematching the same person with 3 people alive. Battlegrounds. I was in the top 3 in a random low rated BG and I noticed that after having battled Yogg and lost to him, next combat I was matched against him again. Which never happens in BG."
battlegrounds exploit,5,https://www.hearthpwn.com/forums/hearthstone-game-modes/battlegrounds/247476-firewall-exploit,HS Battlegrounds Exploit? Discussion. So I just played a game of hs battlegrounds and when we were only two left something interesting happened. The guy apparently sold his board except for three minions and of course he lost. He was at 13 hp that time and I killed him (saw the animation). Expecting the game to end I started celebrating 1st ...
battlegrounds exploit,6,https://exploitplay.com/wwe-2k-battlegrounds/,"Exploit doesn't just equalize the game with those who have normal-length combats, it gives a substantial and unfair bonus. Adding a longer minimum turn length would probably be a really good thing for the game, but capping the maximum so that FW Exploiters don't gain a benefit over folks who aren't cheating is more important."
battlegrounds exploit,7,https://robloxscript.guidesbloggers.com/dynasty-battlegrounds-infinite-energy/,"WWE 2K BATTLEGROUNDS. The world of WWE is your battleground with all-new, over the top, in-your-face arcade action as your favorite WWE Superstars and Legends battle it out in outlandish interactive environments around the world. Compete in your favorite match types with an arsenal of exaggerated maneuvers, special abilities, and devastating ..."
battlegrounds exploit,8,https://pastebin.com/G8BT3d6Q,"Great goods from you, man. I've understand your stuff previous to and you are just too excellent. I really like what you've acquired here, really like what you are stating and the way in which you say it."
battlegrounds exploit,9,https://pastebin.com/j59Mwm2X,Pastebin.com is the number one paste tool since 2002. Pastebin is a website where you can store text online for a set period of time.
battlegrounds exploit,10,https://wearedevs.net/exploits/,Pastebin.com is the number one paste tool since 2002. Pastebin is a website where you can store text online for a set period of time.
battlegrounds exploit,11,https://acegameguides.com/how-to-get-extra-time-in-hearthstone-battlegrounds/,"Slurp is a formidable competitor to all major exploits due to its vastly superior software integration, original codebase, and support. 502.4k+ downloads. Download. Multiple RBX Games. Usually, you are limited to having only one game open. With this, you can open as many games as you want. 100 games if you felt like."
battlegrounds exploit,12,https://us.forums.blizzard.com/en/wow/t/experience-eliminator-exploit-bug-abuse/157243,"The Hearthstone Battlegrounds skip requires a one-time setup and works throughout Hearthstones game updates. The maximum achievable time with the use of the disconnection bug is over two minutes in the final rounds of the match. Use this time wisely, and improve your Hearthstone Battlegrounds rating!"
battlegrounds exploit,13,https://www.ign.com/wikis/playerunknowns-battlegrounds/Cheats_and_Secrets,"Experience Eliminator Exploit / Bug Abuse. Since Patch 8.1.5 the Experience ON leveling bracket has been separated from the Experience OFF ""twink"" bracket. Previously before this patch player with EXP on and EXP off could queue into the same battleground/ PvP instances. With this change a popular exploit has made a comeback."
battlegrounds exploit,14,https://www.youtube.com/watch?v=_kR7pmQbsFk,"Cheats and Secrets. IGN's PlayerUnknown's Battlegrounds cheats and secrets guide gives you the inside scoop into every cheat, hidden code, helpful glitch, exploit, and secret in PlayerUnknown's ..."
battlegrounds exploit,15,https://eu.forums.blizzard.com/en/wow/t/twinks-queue-exploiting/52276,Hello guys today I have a new video to you guys it's elemental battlegrounds script gui hope y'all enjoy itUpdate script:https://pastebin.com/i0HLnEpdjoin me...
battlegrounds exploit,16,https://www.youtube.com/watch?v=i85wmj0alpU,"Twinks & Queue Exploiting. Recently, Blizzard divided non-120 battlegrounds into ''XP-on'' and ''XP-off'' categories. Following that, a large portion of the twinking community has resorted to using a particular macro to enter XP-on battlegrounds. Without getting into too much detail, the twink will queue with his XP on, and upon ..."
