category,num,url,text
battlegrounds exploit,17,https://cynwise.wordpress.com/2012/06/25/xp-off-battleground-exploit-needs-fixing/,"?”¥Dynasty Serverside is a new serverside that has just came out! Don't know what it is? It's an FE BYPASS! As shown in the video, you will see that everyone ..."
battlegrounds exploit,18,https://www.icy-veins.com/forums/topic/56010-stoneborn-brought-into-battleground-potential-exploit/,"The exploit allows someone to turn off XP while queuing for a regular battleground. Normally, turning off experience places a character in an xp-off battleground with other characters who have done the same. Gear is assumed to be of very high quality in these brackets, and players are assumed to know how to play both their class and the ..."
battlegrounds exploit,19,https://www.pcgamer.com/blizzard-reveals-how-good-your-battlegrounds-mmr-really-is/,"wow Stoneborn Brought Into Battleground Potential Exploit. Here's another ""things that should stop working when zoning in/out"" glitch, as players can actually bring allied mobs with them into battlegrounds and potentially elsewhere as well! Traice2020 was doing the Retaining the Court Revendreth World Quest, where you gather some anima to ..."
battlegrounds exploit,20,https://www.mpgh.net/forum/showthread.php?t=1374459,"<5000 62% of Players 5500+ Top 20% 6000+ Top 10% 6500+ Top 3% 7000+ Top 1% 8000+ Top 0.1% 8700+ Top 0.01% The good news (for me anyway, as I'm sat a hair above 6k) is that if your MMR is over ..."
battlegrounds exploit,21,https://amiibodoctor.com/2020/07/17/how-to-play-patches-the-pirate-in-hs-battlegrounds/,"battleground stack exploit_mpgh.net.rar [Download and Thanks] (1.7 KB, 685 Downloads) Last edited by gaminggoose; 06-18-2018 at 06:40 AM. I have NO outside contact. Beware of impostors. Don't thank me, just hit thanks. The Following 88 Users Say Thank You to gaminggoose For This Useful Post: ..."
battlegrounds exploit,22,https://lavicheats.com/playerunknowns-battlegrounds-hacks-pubg/,"Patches's Hero Power used to deal 4 damage to 2 random enemy minions at the start of combat and cost 1. If memory serves, that was a buff from his original rendition, which was the same thing, but with 3 damage. At that time, he was a lot worse than he is now. At any rate, Patches has a very good Hero Power."
battlegrounds exploit,23,https://trello.com/b/tH8P4m4C/troublesome-battlegrounds-2,"Why Lavicheats.com is the best coders of Pubg hacks out there? Lavicheats is a leading provider of effective and high-quality cheats and hacks for different gameplays, including PUBG, Rust, COD: Modern, Apex legends, undetected Black ops cold war cheats and Overwatch. Our developers create and provide hands-on gameplay cheats that help the online players crank up their XP, level up their ..."
battlegrounds exploit,24,https://exploitplay.com/category/other/page/2/,Troublesome Battlegrounds 2. Members. Badr (inciipient) egg81 (egg81) Sn00dle (sn00dle) Taksumi (taksumi) Toukuri (toukuri) diO_God (dio_god) lamentz (lamentz) majin (xyzkillerguy) Lists. Characters. Phantom Blood Jonathan Joestar William A. Zeppeli Dio Brando Battle Tendency Joseph Joestar Caesar A. Zeppeli
battlegrounds exploit,25,https://en-forum.guildwars2.com/topic/28201-exploit-on-eternal-battlegrounds/,"Exploit. 18.09.2020. Comments Off. on Hades. Other. Hades Hades is a god-like rogue-like dungeon crawler that combines the best aspects of Supergiant's critically acclaimed titles, including the fast-paced action of Bastion, the rich atmosphere and depth of Transistor, and the character-driven storytelling?? Read More."
battlegrounds exploit,26,https://variety.com/2018/gaming/news/pubg-sanhok-exploit-1202863485/,"There is still a way to get under the map on Eternal Battlegrounds...I first reported this bug about 4 months ago so i thought i try again... Since i am not allowed to share details here, i wont =PFor more information its best to contact me( Helios.5196 on Kodasch) ingame, since i rarely drop by here in the forum.Information will only be shared with official support."
battlegrounds exploit,27,https://hearthstone.fandom.com/wiki/Pogo-Hopper_(Battlegrounds),"Players Discover Exploit in Newest 'PlayerUnknown's Battlegrounds' Map. ""PlayerUnknown's Battlegrounds"" finally welcomed its new Sanhok map with an official debut on June 22 for PC ..."
battlegrounds exploit,28,https://roblox-elemental-battlegrounds.fandom.com/wiki/Explosion,"Battlecry: Gain +2/+2 for each other Pogo-Hopper you played this game.See this card on Hearthpwn Pogo-Hopper was a Tier 2 minion in the Battlegrounds game mode. Pogo-Hopper was one of the hardest cards to play in the game because its buff was heavily dependent on rolling itself multiple times. Pogo-Hopper builds were very RNG-reliant, and other scaling minions like Wrath Weaver and Rabid ..."
battlegrounds exploit,29,http://lite.pubg.com/landing/lp01/en,"Explosion is a Superior Element in Elemental Battlegrounds. Its color palette consists of orange, red, white, and blue. Its medal depicts an explosion with a swirl in the middle. Explosion works best at close range, having defensive capabilities and Spells that can control the distance of the battle fairly consistently. This Element costs 1100 Diamonds. Explosion is specialized in damage and ..."
battlegrounds exploit,30,https://www.geoad.org/elemental-grind-game-mythic-script/,"PUBG Lite is a free-to-play adaptation of PLAYERUNKNOWN'S BATTLEGROUNDS, allowing those with less access to high end hardware to enjoy the same thrilling situations and intense gunplay PUBG fans around the world have come to love. So drop in, loot up, and battle it out to be the last one standing!"
battlegrounds hack tool,1,https://www.privatecheatz.com/playerunknowns-battlegrounds-hack/,"Battlegrounds hacks will take you far, but a great drop will help kick it up a notch. There are a lot of things to remember when it comes to players PUBG, but knowing the map will always remain a top priority. Well, that and ensuring that you've got the best playerunkown's battlegrounds hack on your side."
battlegrounds hack tool,2,https://battlelog.co/pubg-hacks/,
battlegrounds hack tool,3,https://hackgame-tools.com/cheats/free-playerunknowns-battlegrounds-cheat-pubg-hack-wallhack-aimbot-pc/,"Playerunknown Battlegrounds Hacks - How we keep them safe. ... Always be on the lookout if hack providers are the real deal, and also never download free pubg cheats from a forum. ... An aimbot is a tool that allows you to shoot your enemies without having to aim manually. It helps you to shoot more accurately with less skill."
battlegrounds hack tool,4,https://www.hack-cheat.org/gfx-tool-for-battlegrounds-new-v18,"DOWNLOAD Startup Pack. DOWNLOAD Last 2021 Script. Our PUBG hack are completely undetected so there is no risk to your account. If you're already familiar with cheats and such, then this won't be a very big surprise to you. PlayerUnknown's Battlegrounds is the newest rendition of shooter games to be considered, and it's much better than ..."
battlegrounds hack tool,5,https://gamehakz.com/bullet-strike-battlegrounds-hack-tool-online/,"GFX Tool for BattleGrounds (NEW) V.18 tricks hints guides reviews promo codes easter eggs and more for android application. Avoid GFX Tool for BattleGrounds (NEW) V.18 hack cheats for your own safety, choose our tips and advices confirmed by pro players, testers and users like you. Ask a question or add answers, watch video tutorials & submit own opinion about this game/app."
battlegrounds hack tool,6,https://lavicheats.com/playerunknowns-battlegrounds-hacks-pubg/,Evolving into the best Bullet Strike Battlegrounds gamer and accelerating the progress for winning the game is easy. Grab your endless cash and coins resources by using our free Bullet Strike Battlegrounds hack tool. Bullet Strike Battlegrounds Hack 2020 - Generate Unlimited Resources Today!
battlegrounds hack tool,7,https://www.freefirepass27.com/,"Playerunknown Battlegrounds Hacks - Why we are Safest Cheats Provider Our developers at Lavicheats have designed metamorphic cheats with signature methods and custom, encrypted code to ensure that they stay undetectable to various anti-cheat software and tools, including BattleEye, VAC, and Xenuine."
battlegrounds hack tool,8,https://www.cheat-god.com/cheats/free-playerunknowns-battlegrounds-cheat-pubg-hack-wallhack-aimbot-pc/,Visit this webpage to generate free ressources now with our new Online HACK! Free Fire Battlegrounds Hack Online Tool . Enter your game username and platform. Access Generator Generate ...
battlegrounds hack tool,9,http://hackscommunity.com/freefire/,"FREE Download: PUBG Hack / Cheat. Wallhack, Aimbot and Radar Hack for Playerunknown's Battlegrounds. Undetected for Windows PC only."
battlegrounds hack tool,10,https://www.iwantcheats.net/pubg-hacks/,Online Generator Tool. Free Fire Battlegrounds Hack Diamonds & Coins Generator. Account Details. Please enter your username for Free Fire Battlegrounds and choose your device. Username: Device: Proceed. Secure Connection. Please choose one of our proxy servers from the options below. London. Online. AES-256 Encryption.
battlegrounds hack tool,11,https://apkpure.com/battlegrounds-advanced-graphics-tool-no-ban/jediarstudios.pubgmct,"Right now Playerunknown's Battlegrounds on Steam is the most popular game being played with over 450,000 daily players. 70% of the player base on PUBG is currently using hacks. Hack PUBG to win every round of PUBG that you play. The PUBG hacks are coded so well that you won't get banned and the anti-cheat can't detect you."
battlegrounds hack tool,12,https://kow-foundry.com/hack/365cheats-com-free-fire-battlegrounds.php,"The description of Battlegrounds Advanced Graphics Tool [NO BAN] App BAGT is developed for people who wants to fully customize and optimize graphics and get you more Chicken Dinners. Ranging from midrange to flagship phones, this is the perfect tool for better gaming experience."
battlegrounds hack tool,13,https://hackpubg2018free.blogspot.com/,"The Hack Tool for 365cheats.com Free Fire Battlegrounds also work for Android, iOS and Facebook which you decide on before using the generator and follow the instructions. It's clear that you have a lot of advantages in the game by using the 365cheats.com Free Fire Battlegrounds Tools."
battlegrounds hack tool,14,https://justsmile-friend.blogspot.com/2019/07/free-fire-battlegrounds-hack-tool-4u.html,"cheat playerunknown's battlegrounds cheat PUBG hack PUBG hack PUBG free playerunknown's battlegrounds crack playerunknown's battlegrounds hack PUBG TOOL V 1.0 PUBG TOOL V 1.5 PUBG TOOL V 1.7 PUBG TOOL V 2.0 PUBG TOOL V 2.0 beta. Total Pageviews ""I do not have much time, so I need it to improve my ability."""
battlegrounds hack tool,15,https://www.reddit.com/r/firebattlegrounds/,"Free Fire Battlegrounds Hack Tool 4U For Pro Players ï»¿without paying a dime. free fire garena became a requirement have for many gamers as everyone is making an attempt to achieve a glance that is unique and superior to alternative players. However, buying them in-game has become a difficult subject as some players can't afford whereas some ..."
battlegrounds hack tool,16,https://www.elitepvpers.com/forum/playerunknowns-battlegrounds/,"Working Free Fire Battlegrounds Hack diamonds and Coins - For Life free fire battlegrounds hack - gold, gems, coins - resources generator. For Widnows, Android and iOS doesn't require root or jailbreak.free fire battlegrounds Coins, Gems, Resources Hack Tool / Generator So if you're stuck somewhere, or just for fun, or to go beyond a level where you're struggling or to become one of the best ..."
battlegrounds hack tool,17,https://play.google.com/store/apps/details?id=jediarstudios.pubgmct&hl=en_US&gl=US,"Download or share your PlayerUnknown's Battlegrounds hack at world's leading forum for all kind of PlayerUnknown's Battlegrounds hacks, cheats and aimbots. Here you will find a list of discussions in the PlayerUnknown's Battlegrounds forum at the Popular Games category. Sub-Forums : PlayerUnknown's Battlegrounds."
battlegrounds hack tool,18,https://gunkinku.amebaownd.com/posts/7098040,"BAGT is developed for people who wants to fully customize and optimize graphics and get you more Chicken Dinners. Ranging from midrange to flagship phones, this is the perfect tool for better gaming experience. 1. If you changed ANYTHING in the in-game graphics settings, please close the game and re-apply your setting from BAGT before playing. 2."
battlegrounds hack tool,19,https://advancpesens.blogspot.com/2021/06/roblox-elemental-battlegrounds-hack.html,"publish Date: 21 Dec, 2017. resume: PLAYERUNKNOWN'S BATTLEGROUNDS is a battle royale shooter that pits 100 players against each other in a struggle for survival. Gather supplies and outwit your opponents to become the last person standing. PLAYERUNKNOWN'S BATTLEGROUNDS hack tool zip password. PLAYERUNKNOWN'S BATTLEGROUNDS hack xmodgames iphone"
battlegrounds hack tool,20,https://cheatallgame.com/free-fire-battlegrounds-hack-2019-the-best-hack-tool-to-get-free-diamonds/,"roblox elemental battlegrounds hack diamonds. Roblox Elemental Battlegrounds Hack Diamonds ... If you have planned to avail the free robux hack tool for the game play, you can receive it by online. After you have opened the site that provides the free robux, you want to give the necessary details that it asks. ..."
battlegrounds hack tool,21,https://in.pinterest.com/pin/762445411898947713/,"Free Fire Battlegrounds Hack 2019, The Best Hack Tool To Get Free Diamonds. Action November 22, 2019. 0 258 . Free Fire Battlegrounds Hack 2019, The Best Hack Tool To Get Free Diamonds The gaming industry has been growing at a rapid pace. The likes of the players get people to employ various cheats and hack to rise up on the leaderboard faster."
battlegrounds hack tool,22,https://gurugamer.com/mobile-games/free-fire-battlegrounds-hack-2020-12124,"Sep 21, 2019 - Free Fire Battlegrounds Hack Online Tool Free Fire Battlegrounds Hack Online Tool Proof Free Access Free Fire Battlegrounds Online Hack Tool Generator 2019 * Max Free Credits Amount You Can Add To Your Account or Generate Up To 999999999 Per Daily Limit..."
battlegrounds hack tool,23,https://hackofgame.com/free-fire-battlegrounds-hack-2019-get-free-unlimited-diamonds-to-your-account/,The latest version of free fire battlegrounds hack online tool in 2020 is Free Fire MOD APK v1.52. which is comparative to Android 4.0 and higher. Here is the details instruction of how to set up Free fire battlegrounds hack 2020 on your phone: Download the Free Fire MOD APK v1.50. and the OBB file to your phone.
battlegrounds hack tool,24,https://www.pinterest.com/garenafreefirehack0026/free-fire-battlegrounds-hack/,"Free Fire Battlegrounds Hack is very simple to use. All you need to do to get it started is to click on it. Below are the steps you need to follow to make it work for you: Click on the 'ONLINE HACK V1', or 'ONLINE HACK V2', or 'ONLINE HACK V3'; visit the website hack and submit all the required information, the click 'generate'."
battlegrounds hack tool,25,https://cheatallgame.com/tiny-battleground-hack-2019-free-crystals/,"Jul 13, 2020 - Free Fire Battlegrounds Hack. See more ideas about hacks, cheat online, tool hacks."
battlegrounds hack tool,26,https://hackactiongames.com/,Tiny Battleground Hack Tool is easy to use and can be used in simple steps. It is definitely not Rocket science and nothing in comparison what gamers are subjected to on an everyday basis. There is no installation required for any kind of software on your system. You just need to follow simple steps to get the Hack working.
battlegrounds hack tool,27,https://freefirehacktool.club/,"Game Hack Tool. 12 October, 2020 / By Jadon Rogahn. Legacy Of Discord Furious Wings Hack Cheats Unlimited Diamonds. The rising fame of Legacy of Discord Furious Wings game among Android and iOS players have caught the attention. Game Hack Tool. 11 October, 2020 / By Jadon Rogahn. Mutants Genetic Gladiators Hack Cheats Unlimited Gold."
battlegrounds hack tool,28,https://friv2games.org/zombie-battleground-hack-tool-online-premium-100-working-cheat-999k-gold/,This is the latest and 2021 updated Garena Free Fire Hack tool online. No Software or App Download To Use Free Fire Generator. We have successfully launched the Garena Free Fire Diamonds Generator on an online server. We also can make software or app for your compatible devices. But software or app is not a good thing for your device they can ...
battlegrounds hack tool,29,https://www.technovimal.in/hack-battlegrounds-mobile-india-pubg.html,Our team is so pleased to declare that the Zombie Battleground hack tool is finally prepared after putting an enormous effort in the creation of our 100% working game hack tool. Zombie Battleground Hack 2020 - Obtain Unlimited Resources Now! It usually requires a lot of time to get a victory in the Zombie Battleground.
battlegrounds hack tool,30,https://www.centerffs.org/sites/default/files/webform/internships/coverletters/10por-garena-free-fire-hack-diamonds-generator-Ur1D.pdf,"PUBG Hack is nothing but implementing an additional script to the main Battlegrounds Mobile India (PUBG) mobile game so that players can get a few extra things for the game for free. With this Battlegrounds Mobile India (PUBG) Hack, players will get a list of useful things such as AimBot, No Recoil, Speed Hack, Wall Hack, and more."
battlegrounds hack,1,https://cheatautomation.com/playerunknowns-battlegrounds-hack,
battlegrounds hack,2,https://www.privatecheatz.com/playerunknowns-battlegrounds-hack/,"The game can be made easier by using a Playerunknown's Battlegrounds hack, as seen here. The game can be fun without using any hacks, but each Playerunknown's Battlegrounds hack just makes everything better. Players can see more, do more, and gain more just by using a few extra lines of code. The hacks can be disabled if the player wants ..."
battlegrounds hack,3,https://battlelog.co/pubg-hacks/,"Battlegrounds hacks will take you far, but a great drop will help kick it up a notch. There are a lot of things to remember when it comes to players PUBG, but knowing the map will always remain a top priority. Well, that and ensuring that you've got the best playerunkown's battlegrounds hack on your side."
battlegrounds hack,4,https://lavicheats.com/playerunknowns-battlegrounds-hacks-pubg/,"PUBG Aimbot. Most of our Playerunknown Battlegrounds hacks have aimbot. The aimbots we offer have aim prediction and bullet drop prediction, which makes even long shots at running targets like stealing candy from a child: Easy. This, alongside our wallhack, creates an easy way of killing enemies, while looking legit."
battlegrounds hack,5,https://hackgame-tools.com/cheats/free-playerunknowns-battlegrounds-cheat-pubg-hack-wallhack-aimbot-pc/,"Playerunknown Battlegrounds Hacks - Why we are Safest Cheats Provider Our developers at Lavicheats have designed metamorphic cheats with signature methods and custom, encrypted code to ensure that they stay undetectable to various anti-cheat software and tools, including BattleEye, VAC, and Xenuine."
battlegrounds hack,6,http://www.arcadeprehacks.com/game/53/Battlegrounds.html,"DOWNLOAD Startup Pack. DOWNLOAD Last 2021 Script. Our PUBG hack are completely undetected so there is no risk to your account. If you're already familiar with cheats and such, then this won't be a very big surprise to you. PlayerUnknown's Battlegrounds is the newest rendition of shooter games to be considered, and it's much better than ..."
battlegrounds hack,7,https://www.elitepvpers.com/forum/playerunknowns-battlegrounds/,"Battlegrounds Hacked . Game & Hack Information . Apr 26, 2008 27112 Plays Strategy 3.24 MB. Hacked By: Proditor . Tweet. Hack Information: 9999999 money and max power. Game Information In this Real Time Strategy game, you have to build and upgrade an army to win the war against orcs, in 8 different missions."
battlegrounds hack,8,https://www.reddit.com/r/hearthstone/comments/kf3t4s/new_battlegrounds_hack/,"Download or share your PlayerUnknown's Battlegrounds hack at world's leading forum for all kind of PlayerUnknown's Battlegrounds hacks, cheats and aimbots. Here you will find a list of discussions in the PlayerUnknown's Battlegrounds forum at the Popular Games category. Sub-Forums : PlayerUnknown's Battlegrounds."
battlegrounds hack,9,https://www.hack-cheat.org/gfx-tool-for-battlegrounds-new-v18,"New Battlegrounds Hack? Discussion. So I've run across this twice now today and wanted to see if anyone knew if there was some new hack out for Battlegrounds. Basically, during the matches I match up with someone and I beat them but they take no damage (no, they don't have the mage secret) and then the rest of the matches it shows that hero as ..."
battlegrounds hack,10,http://hackscommunity.com/freefire/,"GFX Tool for BattleGrounds (NEW) V.18 tricks hints guides reviews promo codes easter eggs and more for android application. Avoid GFX Tool for BattleGrounds (NEW) V.18 hack cheats for your own safety, choose our tips and advices confirmed by pro players, testers and users like you. Ask a question or add answers, watch video tutorials & submit own opinion about this game/app."
battlegrounds hack,11,https://www.youtube.com/watch?v=_kR7pmQbsFk,Free Fire Battlegrounds Hack Diamonds & Coins Generator. Account Details. Please enter your username for Free Fire Battlegrounds and choose your device. Username: Device: Proceed. Secure Connection. Please choose one of our proxy servers from the options below. London. Online. AES-256 Encryption. Speed: 1 GBPs. New York.
battlegrounds hack,12,https://x22cheats.com/cheats/playerunknowns-battlegrounds,Hello guys today I have a new video to you guys it's elemental battlegrounds script gui hope y'all enjoy itUpdate script:https://pastebin.com/i0HLnEpdjoin me...
battlegrounds hack,13,https://www.mpgh.net/forum/forumdisplay.php?f=913,"PlayerUnknown's Battlegrounds Cheat. PUBG Cheats Our PUBG Cheats are leading in the cheat industry. We offer the best solution for legit, rage or HvH players. Our Aimbot gives you full control over the game, you can rage or play legit like a pro."
battlegrounds hack,14,https://wallhax.com/hacks/battlefield-5/,"Welcome to MPGH - MultiPlayer Game Hacking, the world's leader in Game Hacks, Game Cheats, Trainers, Combat Arms Hacks & Cheats, Crossfire Hacks & Cheats, WarRock Hacks & Cheats, SoldierFront Hacks & Cheats, Project Blackout Hacks & Cheats, Operation 7 Hacks & Cheats, Blackshot Hacks & Cheats, A.V.A. Hacks & Cheats, Call of Duty Hacks & Cheats, Gunz Hacks & Cheats, Quake LIVE Hacks & Cheats ..."
battlegrounds hack,15,https://awareearth.org/battlegrounds-mobile-india-hack-pubg-mod-apk/,"Battlefield V Testimonial This hack is superb, and I am able to top the scoreboard almost every round, if not coming in second place. The loader was easy to use and simple enough to just log in, launch the hack, and get right into a game. The simplistic design of the UI helps a lot ..."
battlegrounds hack,16,https://www.youtube.com/watch?v=LRkK50gClRc,"PUBG Hack - Battlegrounds Mobile India Mod APK Will also helps you to increase them. A rotating ""occasion mode"" became delivered to the sport in March 2018. These occasions alternate up the ordinary recreation rules, together with setting up large groups or squads, or changing the distribution of guns and armor throughout the sport map."
battlegrounds hack,17,https://hackofgame.com/free-fire-battlegrounds-hack-2019-get-free-unlimited-diamonds-to-your-account/,Here is the link to the scriptlink:https://pastebin.com/W54kPLzecan we reach 500 subs pls and enjoy the hack!
battlegrounds hack,18,https://www.ownedcore.com/forums/fps/playerunknowns-battlegrounds-hacks-cheats/,"Free Fire Battlegrounds Hack is very simple to use. All you need to do to get it started is to click on it. Below are the steps you need to follow to make it work for you: Click on the 'ONLINE HACK V1', or 'ONLINE HACK V2', or 'ONLINE HACK V3'; visit the website hack and submit all the required information, the click 'generate'."
battlegrounds hack,19,https://hackpubg2018free.blogspot.com/,Aphro FREE WoW Shadowlands Bot-PVP-Quest-Gather-Gold Farm. Antorus ?”¥WoW TBC available!!! ARENA 1400-2400/Gladiator/lvling 50-60/Mythic RAID/Mythic +2-20/Gearing?”¥. Kingboostnet ?•FULL GEAR NATHRIA HEROIC 99???•M+15 TRADE 12????3x3 1800 SELF 89?¬â™•.
battlegrounds hack,20,https://cheatautomation.com/,"cheat playerunknown's battlegrounds cheat PUBG hack PUBG hack PUBG free playerunknown's battlegrounds crack playerunknown's battlegrounds hack PUBG TOOL V 1.0 PUBG TOOL V 1.5 PUBG TOOL V 1.7 PUBG TOOL V 2.0 PUBG TOOL V 2.0 beta. Total Pageviews ""I do not have much time, so I need it to improve my ability."""
battlegrounds hack,21,https://www.gamesradar.com/pubg-cheats-explained/,"Dominate your opponents with the help of our bone aimbots, tuned for accuracy, speed, and performance. Lock-on instantly for easy head-shots or tweak your settings for full 'legit' play. Use our optimized default settings, or tune each aimbot feature, from field of view, custom aim bones, aiming speed, and more to your personal preference."
battlegrounds hack,22,https://cheatallgame.com/free-fire-battlegrounds-hack-2019-the-best-hack-tool-to-get-free-diamonds/,"PlayerUnknown's Battlegrounds cheats explained. By Mike Stubbs 29 May 2020. Discover the world of PUBG cheats, bot, or hack ... Players have been using PUBG cheats since the days of early access ..."
