category,num,url,text
PUBG exploit,12,https://lavicheats.com/playerunknowns-battlegrounds-hacks-pubg/,"Players Discover Exploit in Newest 'PlayerUnknown's Battlegrounds' Map. ""PlayerUnknown's Battlegrounds"" finally welcomed its new Sanhok map with an official debut on June 22 for PC ..."
PUBG exploit,13,https://realsport101.com/mobile-games/pubg-mobile-season-12-release-date-skins-vehicle-weapons-leaks-bots-how-to-spot-exploit-ai-enemies-cosmetics-royale-pass-india/,"PUBG Hack/Cheat Features Name ESP - PUBG hack ESP Stands for Extra Sensory Perception and is a type of compromise in the game. This enables the user to spectate the game as a third party and one can see the name of every other player anywhere on the map. PUBG Wallhack PUBG wallhack, as the name suggests, helps user to see through the wall."
PUBG exploit,14,https://www.thenerdmag.com/pubg-exploit-sanhok-map-invisible/,"With 100 players per game, it is tough to outlast everyone. However, not every player is what they seem, making some easier to pick off and exploit. That's because they might be bots. PUBG Mobile bots"
PUBG exploit,15,https://gamerant.com/pubg-sanhok-map-exploit/,"PUBG's new map Sanhok is one of the most highly anticipated upgrades that fans have been waiting for and so far it has delivered exceptionally, dubbed as mini-royale, Sanhok is the smallest map so far, with a very green terrain and loads of buildings, however, despite its praise a PUBG exploit in Sanhok map exists that is causing players to gain an unfair advantage over others."
PUBG exploit,16,https://www.sikktech.com/esp-hack-pubg-mobile.html,"PUBG's Sanhok Map Exploit Needs to Be Fixed. A new exploit is found in PlayerUnknown's Battlegrounds' new map, Sanhok, which allows players to completely disappear from view and easily get the ..."
PUBG exploit,17,https://www.youtube.com/watch?v=bGVSEM0NJZo,"PUBG Mobile esp hack is a type of exploit that is used to retrieve the location of the opponent player or an enemy.PUBG Mobile, PUBG Mobile Lite, and other popular game hacks include esp hack.In online games esp hack or exploit are mainly used to determine the player."
PUBG exploit,18,https://www.sikktech.com/exploits,Twitch: https://twitch.tv/imaveragesniperThanks for all the views on my first BRDM-2 Video: https://www.youtube.com/watch?v=rLJ_XCbLf-QFacebook: https://www....
PUBG exploit,19,https://newstate.pubg.com/index.html,"EXPLOITS. ROBLOX ARTICLES SCRIPT. Roblox Scripts - Download Roblox Premium Scripts For Free 2021. Roblox Scripts ... PUBG Mobile esp hack is a type of exploit that is used to retrieve the ... 3 days Ago. CSGO ESP PC. CSGO Osiris Undetected (ESP, Aimbot, Triggerbot) Download 2021."
PUBG exploit,20,http://lite.pubg.com/landing/lp01/en,"PUBG NEW STATE offers the original battle royale experience of PUBG on mobile. PUBG:NEW STATE is the new battleroyale developed by PUBG Studio, the company behind PLAYERUNKNOWN'S BATTLEGROUNDS. Pre register now on the PUBG: NEW STATE official website and claim exclusive rewards."
PUBG exploit,21,https://www.esportstalk.com/news/pubg-mobile-introduces-new-anti-cheat-spectator-mode-exploit/,"PUBG Lite is a free-to-play adaptation of PLAYERUNKNOWN'S BATTLEGROUNDS, allowing those with less access to high end hardware to enjoy the same thrilling situations and intense gunplay PUBG fans around the world have come to love. So drop in, loot up, and battle it out to be the last one standing!"
PUBG exploit,22,https://www.youtube.com/watch?v=Z1UIEm6JNic,"PUBG Mobile players always seem to find a new exploit or way to game the system, and this week is no different. The latest thing is to take advantage of an exploit in Spectator Mode by using two devices to pinpoint enemy players' locations. However, PUBG Mobile has dropped a new anti-cheat measure to deal with players looking to exploit the ..."
PUBG exploit,23,https://www.pubg.com/en-us/category/esports-en-us/,Found a exploit people can use to cheat. Me and my team killed a guy in the spot im showing you in the video. This video is not meant for people to use fo...
PUBG exploit,24,https://www.pubgmobile.com/,"Posted June 17, 2020 in Announcements, Esports. Predict the champions of PCS 1! Pick'Em Challenge is now available. Hello, PUBG Esports fans! With the PUBG Continental Series 1 (PCS 1), the 2020 global PUBG Esports event to name each region's best teams is also welcoming the return of?? Read More."
PUBG exploit,25,https://www.pubg.com/en-us/terms-of-service/,"PUBG MOBILE is a Battle Royale mobile game created independently by Lightspeed & Quantum Studios of Tencent Game, officially licensed by PLAYERUNKNOWN'S BATTLEGROUNDS. It was released globally in March 2018. Built with Unreal Engine 4, PUBG MOBILE focuses on visual quality, maps, shooting experience, and other aspects, providing an all ..."
PUBG exploit,26,https://kotaku.com/pubgs-new-map-has-a-game-ruining-exploit-1827259436,"(a) without written permission from PUBG, use, advertise or exploit in any manner the Game or any of its parts commercially, including but not limited to use at a cyber (Internet) cafÃ©, computer gaming center or any other location-based site;"
PUBG exploit,27,https://inc42.com/buzz/gamers-exploit-loopholes-to-bypass-indias-pubg-mobile-ban/,"A PUBG article about a glitchy exploit allowing people to troll running immediately after a Fortnite article about a huge, well-executed community event that got people really excited seems like a ..."
PUBG exploit,28,https://20cheats.co/product/pubg-radar-hack-xbox-one-ps4-1-week/,"PUBG Mobile, for which China-based Tencent Games is the publishing partner, was banned in India in September, as part of the Indian government's ban on 118 Chinese apps believed to be ..."
PUBG exploit,29,https://www.proprofsdiscuss.com/q/1536168/what-glitches-can-i-exploit-in-pubg-mobile,"Pubg Radar Hack Xbox/PS4/Xbox one is a cheat that allows players to see the positions of all other players on the map, giving them an instant advantage.The maps, which keep shrinking and driving players towards the center, are detailed and have several hiding spots for crafty players. Using a Pubg Radar Hack Xbox/PS4/Xbox one reveals all other ..."
PUBG hack tool,1,https://pubguchacks.com/,"PUBG UC Hack implies straightforward stunts to produce free UC. It is a protected and 100% working technique, so you don't need to stress over it. We will use some cool techniques which will assist you with getting Royale pass."
PUBG hack tool,2,https://hwcol.com/2021/01/25/pubg-mobile-hack-generator-tool/,
PUBG hack tool,3,https://hackgame-tools.com/cheats/free-playerunknowns-battlegrounds-cheat-pubg-hack-wallhack-aimbot-pc/,PUBG MOBILE Hack & Generator Tool. Access Online Hack Tool. PUBG MOBILE Hack. PLAYERUNKNOWN'S BATTLEGROUNDS goes mobile - the original Battle Royale game is now available on your device! 1. Official PUBG on Mobile 100 players parachute onto a remote 8Ã—8 km island for a winner-takes-all showdown. Players have to locate and scavenge their ...
PUBG hack tool,4,https://battlelog.co/pubg-hacks/,"100% undetected: VAC, Video Proof, BattlEy. Spectator Protection. safe to use. DOWNLOAD Startup Pack. DOWNLOAD Last 2021 Script. Our PUBG hack are completely undetected so there is no risk to your account. If you're already familiar with cheats and such, then this won't be a very big surprise to you. PlayerUnknown's Battlegrounds is the ..."
PUBG hack tool,5,https://pubggfx.com/download-pubg-mobile-hack/,"PUBG Hack by Battlelog.co PUBG Cheats with Aimbot, ESP / Wallhack, Radar hack, and more. If you are looking for undetected PUBG hacks with aimbot, ESP and radar hack, you have come to the right place! At Battlelog, we offer the industry's best and safest PUBG hacks."
PUBG hack tool,6,https://lusogamer.com/pubg-mod-tool/,"Download PUBG Mobile Hack APK for {Android & IOS} 2021. April 26, 2021. April 1, 2021 by Capra. PUBG Mobile Hack - PUBG stands for (PlayerUnknown's Battlegrounds) in which 100 players have to survive on land and try to win the game. The players have to choose whether they want to play solo or duo or with any squad."
PUBG hack tool,7,https://nextalerts.com/2020/12/25/pubg-mobile-hack,What is PUBG Mod Tool Apk. It is a PUBGM hacking tool developed by ALiN36000 for action game lovers. The main purpose of developing this hacking Apk was to entertain gamers with the latest App. Through which the players can easily infiltrate inside the game using third party plugins. Thus the apk comes with new ultra options inside the gameplay ...
PUBG hack tool,8,https://www.cheat-god.com/cheats/free-playerunknowns-battlegrounds-cheat-pubg-hack-wallhack-aimbot-pc/,Minimize the PUBG game and open virtual again and open PUBG ESP Hack tool from Virtual Space; Now Open PUBG Mobile and you have done; PUBG ESP Hack for Root Users (Updated for 1.4.0): Firstly Download and install PUBG ESP Root in your device [if you having PUBG 32 bit then download PUBG ESP root 32 bit otherwise download 64 bit of ESp Tool 64 bit]
PUBG hack tool,9,https://gamercaptain.com/free-pubg-uc-generator-hack/,"This PUBG hack is 100% undetected! There here is no risk for your account to get banned. If you're already familiar with PUBG Hacks, then this won't be a big surprise to you. PUBG is the newest rendition of shooter games, and it's much better than the original version (batch). PUBG is a free game, which means that there are a lot of ..."
PUBG hack tool,10,https://www.sikktech.com/pubg-mobile-injector-download.html,"This PUBG Hack Tool works worldwide. The database has deploy codes from all around the globe just for your convenience. How much free PUBG UC or PUBG BP can I redeem? There is no limit, but please do not abuse the generator to keep it working for everyone. FREE PUBG UC & BP."
PUBG hack tool,11,https://www.iwantcheats.net/pubg-hacks/,"PUBG Mobile Injector 1.4 + Antiban App Free Download. Injector is a tool or an apk which contains direct codes, which runs on ANDLua+ based program. These hacks or hacking tool are ban in android store or Play Store. These apps help us to direct put the code without using the hack script. Pubg mobile esp free download for Android devices is ..."
PUBG hack tool,12,https://www.ninjapubgmobile.com/,PUBG Hacks do exist and IWantCheats is the first website to release the best-undetected PUBG Hacks for the game.Our new coder introduced our undetected PUBG Hacks to our user base this year and it delivers chicken dinner all day long. When PUBG first came out we released our hacks the same day.Our team helps you win that chicken dinner with every game you play using our PUBG Hack.
PUBG hack tool,13,https://mokkaofficial.com/pubg-mobile-skin-changer-tool/,"NINJA PUBG MOBILE. We are a privately-owned company and have been providing hacks and bypass services since 2 years now. The genesis of the service was in the support team, but over time, in an effort to best fulfill the needs of our customers, pubg mobile emulator hacks has developed into a Server with a group of managed support team also."
PUBG hack tool,14,https://www.sikktech.com/pubg-mobile-emulator-hack-download.html,This Hack Now Update pubg mobile 1.3 new version. I made a table for the most used weapons in-game to be changed to upgraded weapon skins. ... 1- Run game normally till you reach the lobby. 2- Start the cheat engine tool and activate any skin you want. 3- Make sure to wait around 5 sec before the next weapon. Note: You need to restart before ...
PUBG hack tool,15,https://www.pubgmobilehacker.net/,"PUBG Mobile emulator hack working with the gameloop, if you using this tool then you will able to hack PUBG Mobile. This hack working and you can get a free key by just visiting their website. This emulator hack has esp line, esp box and aimbot like hacks."
PUBG hack tool,16,https://www.t-developers.com/2021/06/15/pubg-season-19-esp-and-injector-v10-hack-free-download-root-nonroot-1-4-0/,"We just created the latest PUBG Mobile Hacker tool to give you the unlimited supply of UC, Silver Frag, BP and Royale Pass for your PUBG Account. It will generate you as much UC, Silver, and BP as your desires. It's compatible with all operating systems, including Android, IOS, and Window."
PUBG hack tool,17,https://muahack.com/,"PUBG Season 19 ESP And Injector v10 Hack Free Download Root NonRoot 1.4.0.Injector is a tool or an apk which contains direct codes, which runs on ANDLua+ based program. These hacks or hacking tool are ban in android store or Play Store. These apps help us to direct put the code without using the hack script. PUBG Season 19 ESP And Injector v10 Hack Free Download Root NonRoot 1.4.0"
PUBG hack tool,18,https://apksforest.com/pubg-mobile-emulator-hack/,"MUAHACK.VN - WEB THUÃŠ HACK PUBG MOBILE, HACK PUBG Battleground PC STEAM,TOOL LOL (LMHT) - GENSHI IMPACT - CALL OF DUTY -LOL MOBILE - LIÃŠN MINH Tá»C CHIáº¾N- CROSS FIRE CFVN-VALORANT-LIÃŠN QUÃ‚N MOBILE. HACK PUBG, PUBG MOBILE, PUBG STEAM, APEX LEGEND,CALL OF DUTY, ÄÃ‚U TRÆ¯á»œNG CÃ”NG LÃ, HACK CALL OF DUTY - NICK RÃC LOL - NICK LMHT - ACC ..."
PUBG hack tool,19,https://pubggfx.com/pubg-mobile-money-hack/,"PUBG Mobile Wallhack. The use of a wall hack allows a player to see enemies, items, supply drops, cars, and other important game items through walls, allowing them to loot more easily, find or avoid players, and generally survive a lot longer, therefore earning more XP, rewards, Bp and loot crates. Aimbot Hacks for PUBG Mobile."
PUBG hack tool,20,https://apkpure.com/hack-pubg/com.bedspeed.pubgerupe,PUBG Mobile Money Hack has become one of the famous hack in the last few months and one can have the idea of the popularity of this came by the number of downloads because it crossed more than a hundred million downloads in a year which is a big record.
PUBG hack tool,21,https://vncheats.net/game/hack-pubg-steam,Steps to get these tools. 1) Install the PUBG Hack application. 2) Turn it on and click on watch ad button. 3) Collect 20 coins from your ads. 4) Put any valid email for you. 5) Click Submit. 6) Check your inbox. 7) Every weekend come and check if there is a new update to our tools. Note: All new updates include the prevoius fetures and the new ...
PUBG hack tool,22,https://akdoogle.com/pubg-gfx-tool/,"HACK GAME HACK PUBG STEAM AN TO?N GIÃ Ráº? THUÃŠ TOOL - TOOL LOL - TOOL LMHT - LOL Tá»C CHIáº¾N - PUBG MOBILE - PUBG PC STEAM - HACK COD - HACK CSGO - HACK AEPX - HACK RUST - HACK RAINBOW AN TO?N UY TÃN. Hack PUBG an toÃ n nháº¥t 2021, TÃ­nh nÄƒng Aimbot Esp Wallhax No recoil. Há»?trá»?cÃ i tá»?xa."
PUBG hack tool,23,https://cheatallgame.com/pubg-mobile-hack-2019/,"PUBG GFX for IOS. GL app is the best GFX tools application iPhone & its free,cross API 3D graphic and cross platform , the renders quality and long term performance stability and battery consumption with this single app. Second best graphics app tool for iPhone is GFX Metal app. can boost the game by this great GFX tools app .. this is the perfect app for the best gaming experience."
PUBG hack tool,24,https://pubgmobilefree.com/,Pubg Mobile Hack Tool is easy to use and can be used in simple steps. It is definitely not Rocket science and nothing in comparison what gamers are subjected to on an everyday basis. There is no installation required for any kind of software on your system. You just need to follow simple steps to get the Hack working.
PUBG hack tool,25,https://www.toolboxtamil.com/2021/01/pubg-mobile-esp-hack-download-for.html,We would like to show you a description here but the site won't allow us.
PUBG hack tool,26,https://top1pubg.net/,"PUBG Mobile In Best feuture. One Flight in 100 players With your friends in Play With best Shooting Game real online Play Map With 8x8 km small beautiful island in Play can talk with High-quality Graphics and HD Audio talk HD Power Full Visual Effect in All This PUBG Mobile game Play Effect Fore Air Dropping, Gun skin, Dress, skin, Tree Skin ..."
PUBG hack tool,27,https://vncheats.net/,HACK AN TO?N - á»”N Äá»ŠNH - GIÃ Ráº?NHáº¤T VIá»†T NAM. CHO THUÃŠ HACK PUBG STEAM - PUBG MOBILE - PUBG LITE - HACK Tá»C CHIáº¾NNHáº¬N MUA HACK THEO YÃŠU Cáº¦U. Báº®N TIá»€N QUA T?I KHOáº¢N. VIETCOMBANK. Sá»?TK 0541000213973. CHá»?TK NGUYEN CAO SANG. Náº P QUA MOMO Tá»?Äá»˜NG Cá»˜NG TIá»€N V?O T?I KHOáº¢N 24/24. Náº P QUA INTERNET ...
PUBG hack tool,28,https://mokkaofficial.com/pubg-mobile-tool/mokka-official-tool/,"Tool lol, Tool lmht, ThuÃª Tool, Hack PUBG, Hack COD, Hack CSGO, Hack RUST, Hack APEX, Tool tá»‘c chiáº¿n, Hack PUBG MOBI. An toÃ n uy tÃ­n há»?trá»?cÃ i 24/7. Thá»?ngay!"
PUBG hack,1,https://battlelog.co/pubg-hacks/,"PUBG Hack by Battlelog.co PUBG Cheats with Aimbot, ESP / Wallhack, Radar hack, and more. If you are looking for undetected PUBG hacks with aimbot, ESP and radar hack, you have come to the right place! At Battlelog, we offer the industry's best and safest PUBG hacks."
PUBG hack,2,https://www.iwantcheats.net/pubg-hacks/,PUBG Hacks do exist and IWantCheats is the first website to release the best-undetected PUBG Hacks for the game.Our new coder introduced our undetected PUBG Hacks to our user base this year and it delivers chicken dinner all day long. When PUBG first came out we released our hacks the same day.Our team helps you win that chicken dinner with every game you play using our PUBG Hack.
PUBG hack,3,https://lavicheats.com/playerunknowns-battlegrounds-hacks-pubg/,
PUBG hack,4,https://www.privatecheatz.com/playerunknowns-battlegrounds-hack/,"PUBG Hack/Cheat Features Name ESP - PUBG hack ESP Stands for Extra Sensory Perception and is a type of compromise in the game. This enables the user to spectate the game as a third party and one can see the name of every other player anywhere on the map. PUBG Wallhack PUBG wallhack, as the name suggests, helps user to see through the wall."
PUBG hack,5,https://pubggfx.com/download-pubg-mobile-hack/,"PUBG is a massive game that has you battling against 99 other people in a world filled to the brim with guns, so sporting a PUBG aimbot is going to make things much easier. Some of the most popular PUBG hack options would be: PUBG Aimbot - Using a PUBG aimbot will ensure that your shots are on target every single time. This is an ideal tool ..."
PUBG hack,6,https://nextalerts.com/2020/12/25/pubg-mobile-hack,Download PUBG Mobile Hack APK for {Android & IOS} 2021. PUBG Mobile Hack - PUBG stands for (PlayerUnknown's Battlegrounds) in which 100 players have to survive on land and try to win the game. The players have to choose whether they want to play solo or duo or with any squad. The players have to play on four different landscapes or maps.
PUBG hack,7,https://anonymouscheats.net/hacks/pubg-aimbot-wallhack/,"PUBG Hack Obb File 2021 - No Footsteps to enemy :-There will be no foot steps signs will be shown to your enemy, so enemy will be confused and you can surprise your enemy and kill them. There are many other features of this PUBG Mobile Hack mod OBB that you can know after installing the game like very smooth game play and many more."
PUBG hack,8,https://www.cheat-god.com/cheats/free-playerunknowns-battlegrounds-cheat-pubg-hack-wallhack-aimbot-pc/,"About our PUBG Hack. Sneak passed anti-cheats with AnonymousCheats PUBG hack for PlayStation, Xbox and PC. While there are many random hacks whose use can easily get you banned from the game, AnonymousCheats provide you with virtually undetectable PUBG hacks with aimbot and wallhack features."
PUBG hack,9,http://www.pubguc.live/,"This PUBG hack is 100% undetected! There here is no risk for your account to get banned. If you're already familiar with PUBG Hacks, then this won't be a big surprise to you. PUBG is the newest rendition of shooter games, and it's much better than the original version (batch)."
PUBG hack,10,https://venusgamer.com/free-pubg-radar-hack-cheat/,"PubG Mobile Hack Online. CONNECT YOUR ACCOUNT. Username. Select your platform. Enable Encryption. CONNECT> User ACCNAME is now connected. Select Amount Of UC. 300,000 600,000 999,999 HACK NOW ..."
PUBG hack,11,https://cheatautomation.com/playerunknowns-battlegrounds-hack,"Free PUBG Radar Hack Cheat. This is the the ONLY PUBG packed-based radar cheat on the web. 100% safe and will work on PC, XBOX and PS4 versions of PUBG. This hack is totally undetectable since it will run on a totally different machine that the one you are playing on. Do not waste your money on hacks that will eventually get you banned."
PUBG hack,12,https://rcheats.net/pubg-hacks/,"PUBG Hack FAQ. What IS PUBG? In May of 2017, PlayerUnknown's Battlegrounds was released on PC through Steam early access. The game is one of the first Battle Royle games based on mods created Brendan Green, who goes by the username PlayerUnknown. Even though in 2017 the game still needed some work to become complete, it became a hit with many ..."
PUBG hack,13,https://gamestwister.com/2021/01/06/pubg-mobile-hack/,"Undetected PUBG Hacks for Steam, Kakao, Gameloop and Lite versions of PUBG. Get access and start dominate right now! Safe aimbot and esp cheats."
PUBG hack,14,https://apkpure.com/hack-pubg/com.bedspeed.pubgerupe,"PUBG Mobile Hack - Generate Unlimited UC & BP Coins! PUBG Mobile Hack:-Welcome to our latest, PUBG Mobile Free UC and BP Coins Generator Get some UC and BP Coins in just two minutes. After numerous long stretches of testing, we eventually found the working content. Presently you've got a perfect device to hack the UC and BP Coins."
PUBG hack,15,https://pubghaxs.com/pubg-emulator-aimbot-esp-hack-download/,1) Install the PUBG Hack application. 2) Turn it on and click on watch ad button. 3) Collect 20 coins from your ads. 4) Put any valid email for you. 5) Click Submit. 6) Check your inbox. 7) Every weekend come and check if there is a new update to our tools. Note: All new updates include the prevoius fetures and the new fetures like: hidden you ...
PUBG hack,16,https://www.sikktech.com/pubg-mobile-emulator-hack-download.html,"PUBG Hack or PUBG Aimbot is a Program that allows us to cheat in PUBG Mobile Emulator. PUBG Hack has a lot of features like aimbot, esp, wallhack, high jump, god view, car fly, no recoil, speed hack, fuel hack, god mode, etc."
PUBG hack,17,https://github.com/topics/pubg-hack,"PUBG mobile emulator hack has so many features that will helps you to win every round of the game. There are so many hackers who uses PUBG mobile emulator hack. Many famous YouTubers also taking advantage of pubg emulator hack. PUBG emulator hack works with gameloop and other emulators such as Bluestacks, Memu emulator, Nox emulator, etc."
PUBG hack,18,https://pubguchacks.com/,"wangzhenjjcn / PUBG_HACK. Star 294. Code Issues Pull requests. STOP UPDATE SINCE 2018-05===PLS SUPPORT ORIGINAL====PUBG CHEAT ç»åœ°æ±‚ç”Ÿ ?ƒé¸¡ ä½œå¼Š å¤–æŒ‚ ?ãƒ¼??Plug-in ADD-ON Ð¼Ð¾?ÐµÐ½Ð½Ð¸?Ð°?? ?ŒëŸ¬ê·¸ì¸. batch cheat pak windows-batch pubg windows-batch-script pubg-hack. Updated on Mar 26, 2020."
PUBG hack,19,https://kingmodapk.com/pubg-mobile-mod-apk/,"PUBG UC Hack implies straightforward stunts to produce free UC. It is a protected and 100% working technique, so you don't need to stress over it. We will use some cool techniques which will assist you with getting Royale pass."
PUBG hack,20,https://delhitrainingcourses.com/blog/pubg-mobile-hacks/amp/,"PUBG Mobile Hack: In order to score good and win every match with the leading score and gaining more battle points and unlimited cash, the player can also use the PUBG Mobile Kr Hack which is a hacking technique. It allows the player to remove the fog, grass and buildings that create obstacle for the players and make them lose their targets."
PUBG hack,21,https://gamercaptain.com/free-pubg-uc-generator-hack/,"How to hack PUBG mobile on Android No Root (2019): The PUBG mobile hack works by simply implementing & executing PUBG hacking script on your android phone while you are playing, so that you can easily make the changes in the PUBG APK build and exploit the extra advantages as compared to other players playing the PUBG game."
PUBG hack,22,https://mobygeek.com/features/how-to-hack-pubg-mobile-14267,"How to get Free UC in PUBG. The PUBG UC/BP Hack is easy to use. In the Account Information section, enter your in-game name. Below, select the platform you play on. Works on Mobile, Steam, PS4, and XBOX. Click the ""Connect"" button. In the Amount of UC and BP section, select the amount of UC & BP you want to generate."
PUBG hack,23,https://pubghaxs.com/vnhax-plus-v11-pubg-emulator-0170-hack/,"The hack will provide you with unlimited battle points to do this. If you are playing on PUBG Mobile Lite, you can try this PUBG Mobile lite hack too. Hack PUBG Mobile 9.0 How to hack PUBG Mobile: Aimbot. With this hack, you will auto-shoot your enemies even when you don't spot them."
PUBG hack,24,https://www.pubgpclite.com/pubg-mobile-emulator-esp-hack-download-vnhax/,"PUBG Hack or PUBG Aimbot is a Program that allows us to cheat in PUBG Mobile Emulator. PUBG Hack has a lot of features like aimbot, esp, wallhack, high jump, god view, car fly, no recoil, speed hack, fuel hack, god mode, etc."
PUBG hack,25,https://www.skycheats.com/,The PUBG Mobile hack by Activegamer is hack similar to vnhax. Active Gamer is an author of that hack. This is the Short Discription about PUBG Mobile Hack by Activegamer. For Updates of latest PUBG tricks and Tips Follow US. Bookmark us. Post navigation ?Previous Post.
PUBG hack,26,https://gameduniya.com/how-to-hack-pubg-mobile-game-100/,"First time trying this mod. Love it from the beginning. Super legit + highly recommend playing with a stack of 5 (because the hack is extremely easy to use so basically you just need to move around and let the mod do the rest). However, do not use rage bot often (I still think Overwatch banned will get you if you do it often)."
