num,url,text
1,https://qhackse.com/best-league-of-legends-hack/,"Our League of Legends hack include any and all methods, techniques or software that can help you to perform better in ranked matches, level up faster, grind more IP or play more efficiently. The most commonly used kind of League of Legends hacks are Zoom Hacks that allow you to customize your camera view and Jungle Timers that allow you to ..."
2,https://www.elitepvpers.com/forum/league-legends-hacks-bots-cheats-exploits/,"League of Legends Hacks, Bots, Cheats & Exploits. Get or release your League of Legends Hacks, Bots, Cheats & Exploits here. [no questions] Here you will find a list of discussions in the League of Legends Hacks, Bots, Cheats & Exploits forum at the League of Legends category. [BOT] LeagueBotNet v3 • Advanced pixel bot for League of Legends!"
3,https://www.gamexploits.com/league-of-legends/exploits/,"League of Legends Exploits. Find the best LoL Exploit for League of Legends. League of Legends Exploits are listed by verified, unverified, and not working. This system is uniquely democratic so you can find the best League of Legends Exploit for you. Submit Exploit."
4,https://www.sikktech.com/league-of-legends-hack-download.html,"League of Legends Hack, Ensoul, Cheats. League of legends hack is a free to use hack. League of legends hackers has undertaken the game but now you can beat them by using our hack. You can boost your gaming performance and can cheat over other players by using league of legends cheats. We are providing you one of best and safest league of ..."
5,https://win.gg/news/6309/league-of-legends-exploit-lets-players-spam-active-items,League of Legends exploit lets players spam active items. Olivia Richman • 22/Nov/20 • 21:48. LoL. Expect Riot Games to hotfix League of Legends in the very near future after the discovery of a new game-breaking bug. Ultra Rapid Fire is a game mode that has stuck around long after its April Fool's release due to its popularity. But now URF ...
6,https://www.ownedcore.com/forums/rts/league-of-legends/league-of-legends-exploits-cheats-hacks/,"Share and discuss League of Legends exploits, cheats, hacks and more! Forum: League of Legends Exploits. Cheats, Hacks. Forum Tools. Mark This Forum Read View Parent Forum; Search Forum. Show Threads Show Posts. Adv. Search. Threads in This Forum. Title / Thread Starter Replies / Views Last Post By."
7,https://hackgame-tools.com/cheats/free-league-of-legends-hack-cheat-pc-windows-download/,"Our vamera tool allows you to gain a tactical advantage by increasing your field of view and camera customization. Our certain Zoom Hack allows you to see the whole map, zooming in and out as far as you would like and thus give you a lot more information and flexibility than you would usually have with the fixed default zoom in League of Legends."
8,https://www.exploit-db.com/exploits/39916,"The Exploit Database is a repository for exploits and proof-of-concepts rather than advisories, making it a valuable resource for those who need actionable data right away. The Google Hacking Database (GHDB) is a categorized index of Internet search engine queries designed to uncover interesting, and usually sensitive, information made publicly ..."
9,https://cheatermad.com/league-of-legends-hacks/,"Hello, everyone, a lot of people were asking me to post something about league of legends hacks, So here I am posting a new and working cheat for LOL, the League of Legends Hacks its a really good cheat with a lot of features.. I will tell you every step clearly how to use it and everything, but please don't abuse this cheat just use it for fun."
10,https://lolscript.net/,"LOL SCRIPT - TRAILER. Just watch the video before purchasing League of Legends script. Undetected keeps you and your account safe thanks to being hidden. There are many features like Evade, auto smite, orbwalker, auto activator. All champions are supported. It works completely safe. JOIN THE LOLSCRIPT COMMUNITY."
11,https://cheatermad.com/league-of-legends-hack-valak-client/,"League of Legends Valak Client Hack provides you with skin changing, rank changing, insta lock, auto-accept, and many other benefits. For example, does a friend of yours want to play the same character like you? That's when you turn on the insta lock feature in the league of legends valak client and it quickly locks the hero you want to you."
12,http://mixigame.net/LOL/index.html,"League of legends Hack. Nickname. Server. North America EU West EU Nordic & East Latin America North Latin America South Brazil Japan Russia Turkey Oceania Republic of Korea. Riot Points. 5,000 Riot Points 7,200 Riot Points 15,000 Riot Points. Blue Essence. 31,500 Blue Essence 63,000 Blue Essence 94,500 Blue Essence."
13,https://www.cheat-god.com/cheats/free-league-of-legends-hack-cheat-pc-windows-download/,"Our vamera tool allows you to gain a tactical advantage by increasing your field of view and camera customization. Our certain Zoom Hack allows you to see the whole map, zooming in and out as far as you would like and thus give you a lot more information and flexibility than you would usually have with the fixed default zoom in League of Legends."
14,https://www.youtube.com/watch?v=YBhlFKSoqeM,"In this video you will show How to hack League of Legends. It's very easy, just you have to download a script from below.Script for windows: http://exe.io/QP..."
15,https://www.pcgamesn.com/league-of-legends/league-of-legends-exploit-lets-hackers-spend-player-s-rp-and-ip,"A newly-discovered exploit in League of Legends is allowing hackers to access the game's store using a browser and a player's ID and session toker. With this information, the hacker can then ..."
16,https://tekhacks.net/best-league-of-legends-hack/,"Our League of Legends hack include any and all methods, techniques or software that can help you to perform better in ranked matches, level up faster, grind more IP or play more efficiently. The most commonly used kind of League of Legends hacks are Zoom Hacks that allow you to customize your camera view and Jungle Timers that allow you to ..."
17,https://www.mmopro.org/league-of-legends-hacks-exploits-bots-and-programs/,"More than just a forum, Mmopro.org provides you with the top MMO servers ranking list as well as with an appropriate market place to trade or share game codes, gold guides and trusted hacks for your favorite WoW, Blade & Soul, or League of Legends. With Mmopro.org, you can easily keep your gaming experience evolving."
18,http://leagueskin.net/p/download-mod-skin-2020-chn,"LOL PRO (LOL SKIN) a free software. LOL SKIN has been available since 2015.The program helps you try the skin in the game League of Legends very easily and quickly. With very simple usage, the program gives you an interesting feeling.. It is wonderful, the experience you would rather try features unique skin."
19,https://www.gamepressure.com/newsroom/over-3000-bans-issued-in-lol-for-using-an-exploit/zf1bd8,"Over 3,000 Bans Issued in LoL for Using an Exploit. A bug has emerged in League of Legends, causing one character's ability to deal damage to all enemies on the map despite normally limited range. Chinese players using the exploit were banned for three years. Ornn - the perpetrator of all the commotion. The popular youtuber Vandiril, who deals ..."
20,https://www.esports.com/en/wintrading-exploit-in-ranked-league-of-legends-164085,"Content Creator ""Vandiril"" has often found obscure bugs and glitches in League of Legends. Now he has found another opening that is being abused to unfairly climb through the ranks. Recently people started using new exploit, that allows you to play Ranked (soloq and flex) through custom games, allowing for perfect match fixing."
21,https://github.com/Baseult/League-of-Legends-Invite-Spammer,Premade Exploit - Go into Ranked SOLO-Q as 5 men premade RP Exploit - buy rp for free 0 real information needed. 7200rp for free. literally. it's not carding like some dumb idiots say to you ha tru Vandrils wannabes Ranked Exploit - Ye this shit works again XD you just need ***** censored on request. Lets you play rankeds with your friends ...
22,https://www.youtube.com/watch?v=p77ZVHKDZUo,DISCLAIMERI am not encouraging modding or cheating in this video. It is purely for educational purposes only. to companies including but not limited to Daybr...
23,https://www.lolfinity.com/league-of-legends-scripting-explained/,"League of Legends scripting basically refers to a program that takes over some of your actions in-game which is the same concept as to how LoL Bots are able to execute actions without a player controlling them. Generally, a scripter will use League of Legends scripts to assist them in executing difficult combos or automatically react to another ..."
24,https://www.quora.com/Are-there-any-hacks-for-League-of-legends?share=1,"As the Wikipedia ""League of Legends is a multiplayer online battle arena video game developed and published by Riot Games for Microsoft Windows and macOS. Inspired by Warcraft III: The Frozen Throne mod Defense of the Ancients, the game follows a ..."
25,https://shop.x22cheats.com/showthread.php?77405-League-of-Legends-hack-review,"League of Legends hack review #1. impz. View Profile View Forum Posts Customer. Join Date December 8th, 2008 Posts 25. March 20th, 2015 04:34 PM. Well, even though this review is going to be negative, even I have to admit that the level of this hack is pretty darn high. You wouldn't have to worry about getting caught with it."
26,https://github.com/topics/league-of-legends,"An all-inclusive Python framework for the Riot Games League of Legends API. We focus on making the data easy and fun to work with, while providing all the tools necessary to create a website or do data analysis. python api league-of-legends riot-games-api champion-gg-api. Updated 10 days ago. Python."
27,https://strangestrangerz.wixsite.com/gamehacks/lolrp,"The map pack hack option will let your League of Legends account unlock every map created with the game! If you are going to decide to use the experience hack option, I recommend doing it in a single player bot game to farm points so nobody will report you. No Cool Down Hack will let your hero have a zero count on all there abilities."
28,https://gamerant.com/league-legends-plagued-viego-dark-seal-bug/,"League of Legends Plagued by Viego Dark Seal Bug. In one of League of Legends' most-recent patches, it appears that an exploit was introduced that can change Viego into a monster."
29,https://gamefaqs.gamespot.com/boards/954437-league-of-legends/63901335,"For League of Legends on the PC, a GameFAQs message board topic titled ""So the Dr. Terrible no cooldown summoner spells hack is working again?""."
