num,url,text
1,https://www.pcgamer.com/hearthstone-battlegrounds-players-are-using-a-windows-firewall-exploit-to-get-extra-turn-time/,Hearthstone Battlegrounds players are using a Windows firewall exploit to get extra turn time By Tim Clark 4 months ago High-level players Slysssa and Kripparrian explain the problem and how to...
2,https://www.reddit.com/r/classicwowtbc/comments/ngi5fv/battleground_exploit_we_were_about_to_win_until/,Battleground Exploit: We were about to win until we were manually booted one by one. General PvP. Close. Vote. Posted by 3 minutes ago. Battleground Exploit: We were about to win until we were manually booted one by one. General PvP. 0 comments. share. save. hide. report. 50% Upvoted. Log in or sign up to leave a comment Log In Sign Up.
3,https://www.reddit.com/r/classicwow/comments/ngi42k/battleground_exploit_we_were_about_to_win_until/,
4,https://github.com/Breekys/Hearthstone_Battlegrounds_Skip,Battleground Exploit: We were about to win until we were manually removed one by one. Close. Vote. Posted by just now. Battleground Exploit: We were about to win until we were manually removed one by one. 0 comments. share. save. hide. report. 100% Upvoted. Log in or sign up to leave a comment Log In Sign Up.
5,https://www.icy-veins.com/forums/topic/56010-stoneborn-brought-into-battleground-potential-exploit/,"This tool uses an exploit in Hearthstone Battlegrounds to skip battles. It enables you to disconnect and reconnect quickly from the game, so that when you reconnect, you will be in the recruit phase. How to use ? Work only with Windows."
6,https://exploitplay.com/wwe-2k-battlegrounds/,"It's unclear if this was a temporary bug and if it's just related to battlegrounds or if it can actually be used in dungeons, raids etc. But what is VERY clear is that it's an exploit and will almost certainly result in suspensions if misused, so don't try this at home. And obviously big thanks to Traice2020 for reporting the issue!"
7,https://us.forums.blizzard.com/en/wow/t/experience-eliminator-exploit-bug-abuse/157243,"WWE 2K BATTLEGROUNDS - Exploit Play WWE 2K BATTLEGROUNDS The world of WWE is your battleground with all-new, over the top, in-your-face arcade action as your favorite WWE Superstars and Legends battle it out in outlandish interactive environments around the world."
8,https://www.ign.com/wikis/playerunknowns-battlegrounds/Cheats_and_Secrets,"To sum-up the exploit in a few words; The player queues for a regular battleground with his EXP ON. The player then talks to the EXP eliminator NPC and asks to turn the players EXP OFF. The confirmation window comes up, and through a use of a macro script the player manages to join the EXP on battleground he queued for but with his EXP OFF."
9,https://pastebin.com/fTBdnif7,"IGN's PlayerUnknown's Battlegrounds cheats and secrets guide gives you the inside scoop into every cheat, hidden code, helpful glitch, exploit, and secret in PlayerUnknown's Battlegrounds."
10,https://wearedevs.net/exploits/,Pastebin.com is the number one paste tool since 2002. Pastebin is a website where you can store text online for a set period of time.
11,https://www.hearthpwn.com/forums/hearthstone-game-modes/battlegrounds/247476-firewall-exploit,"Slurp is a formidable competitor to all major exploits due to its vastly superior software integration, original codebase, and support. 499k+ downloads. Download. Multiple RBX Games. Usually, you are limited to having only one game open. With this, you can open as many games as you want. 100 games if you felt like."
12,https://pastebin.com/7FAfYHHH,"What's unfair is depending on your battle animations and length some players get more time than others. Turn time should be a fixed amount. People using this exploit are just ensuring a fair timer, everyone should do it. #12 Feb 14, 2021 (Darkmoon Races)"
13,https://gamerant.com/destiny-2-battleground-glitch-foothold-boss-clear/,"Elemental Battlegrounds AFK Aimbot, EXP, Shards, an. DogeGalaxy. Aug 11th, 2018. 2,401 . Never . Not a member of Pastebin yet? Sign Up, it unlocks many cool features! text 1.16 KB . raw download clone embed print report --Made by Lagx,feel free to add me: Lagx65#1587-- while wait(1) do ..."
14,https://cynwise.wordpress.com/2012/06/25/xp-off-battleground-exploit-needs-fixing/,Destiny 2 Battleground Glitch Seemingly Allows for Foothold Instant Clear One Destiny 2 player discovers a new exploit that allows them to instantly clear Battlegrounds: Foothold but things may not...
15,https://cynwise.wordpress.com/2010/02/10/battleground-exploits/,"The exploit allows someone to turn off XP while queuing for a regular battleground. Normally, turning off experience places a character in an xp-off battleground with other characters who have done the same."
16,https://screenrant.com/destiny-2-glitch-easily-clear-battleground-foothold/,"Battleground Exploits I remember riding back to the Stables at Arathi Basin and finding an Undead Mage on top of the roof, running around and slaughtering the Alliance troops underneath him. It was a mad run to try to DoT him up before he could kill me with massive amounts of fire or dive to the other side of the roof to heal."
17,https://forums.elderscrollsonline.com/en/discussion/412426/battleground-chaosball-exploit,"A Destiny 2: Beyond Light player has discovered a new glitch that lets players easily clear the new game mode Battlegrounds: Foothold. Bungie is typically quick to patch these bugs, but currently, the developers are busy with several bugs and players cheating. This is just the latest in a series of glitches plaguing Destiny 2 ' s Season of the Chosen."
18,https://www.youtube.com/watch?v=LARDogE_Jr0,"Battleground chaosball exploit. Leave a Reply. ... All that has to be done to fix this kind of exploit and honestly even balance the game mode is to add a 3 second cooldown to picking up the ball. Oooo ooo, or add ""critical mass."" After a team reached a certain score the ball explodes once the carrier is killed/drops it, causing small AoE ..."
19,https://wowdupe.wordpress.com/tag/battleground/,"jake11price's channel: https://www.youtube.com/channel/UCZEU... Copyright Disclaimer Under Section 107 of the Copyright Act 1976, allowance is made for ""fair..."
20,https://robloxscript.guidesbloggers.com/dynasty-battlegrounds-infinite-energy/,"Tags: Battleground, Bug, Cheat, Exploit, Glitch, Hint, Queue, World of Warcraft, WoW. Comment . 3 Ways to Start EOTS Early. Filed under: WoW Exploit Hack and Cheat news and methods — Leave a comment. July 22, 2010. Here are three ways to exit the Eye of the Storm bubble before the match starts."
21,https://acegameguides.com/how-to-get-extra-time-in-hearthstone-battlegrounds/,"The Streets AIMBOT BYPASS [AIMBOT & AIMLOCK] Limited Simulator 2 AUTO BUY [NEW] Features Created by zxciaz#1337 Enjoy.... Read More November 12, 2020"
22,https://lavicheats.com/playerunknowns-battlegrounds-hacks-pubg/,"Since I started learning Hearthstone Battlegrounds, I spend a lot of time watching many of the popular streamers on Twitch. Since I started learning it didn't take long for me to become aware of the ""disconnect bug"", which allows you to restart your client on difficult turns to get access to some additional time."
23,https://trello.com/b/tH8P4m4C/troublesome-battlegrounds-2,"Why Lavicheats.com is the best coders of Pubg hacks out there? Lavicheats is a leading provider of effective and high-quality cheats and hacks for different gameplays, including PUBG, Rust, COD: Modern, Apex legends, undetected Black ops cold war cheats and Overwatch. Our developers create and provide hands-on gameplay cheats that help the online players crank up their XP, level up their ..."
24,https://www.youtube.com/watch?v=RInahlVXgLY,Troublesome Battlegrounds 2. Members. Badr (inciipient) egg81 (egg81) Sn00dle (sn00dle) Taksumi (taksumi) Toukuri (toukuri) diO_God (dio_god) lamentz (lamentz) majin (xyzkillerguy) Lists. Characters. Phantom Blood Jonathan Joestar William A. Zeppeli Dio Brando Battle Tendency Joseph Joestar Caesar A. Zeppeli
25,https://www.hearthstonetopdecks.com/hearthstone-battlegrounds-guide-best-strategies-compositions/,My website : https://bit.ly/3kwjRoS My Website : https://imodexyt.wixsite.com/imodex Exploit I used in the video : SentinelBuy he...
26,https://exploitplay.com/category/other/page/2/,"Battlegrounds wouldn't be a Hearthstone mode if Khadgar didn't have a word to say in it! In fact, Deathrattle Summon compositions featuring the all-star archmage can easily keep up with other tribe-heavy boards in the early and mid game (as long as you get a few minions that can summon other units - Security Rover is an MVP, for example)."
27,https://roblox-elemental-battlegrounds.fandom.com/wiki/Glitches,"WWE 2K BATTLEGROUNDS The world of WWE is your battleground with all-new, over the top, in-your-face arcade action as your favorite WWE Superstars and Legends battle it out in outlandish… Read More The Sims 4"
28,https://github.com/BammyWahmmy/ROBLOX-EXPLOIT-SCRIPTS/blob/master/Sex%20Script.txt,"Notice: Due to a lot of glitches in this page not being performed at all in long periods of time (e.g. three years), it is entirely possible that this page may contain a lot of misinformation. Proceed at your own risk. Glitches (or Bugs) are events that occur in a game that are not normally supposed to happen. Usually, glitches can be patched, but some are simply glitches with Roblox's physics ..."
29,https://www.wowhead.com/news/alterac-valley-battleground-hotfix-to-fix-abnormally-short-games-319986,"ROBLOX-EXPLOIT-SCRIPTS / Sex Script.txt Go to file Go to file T; Go to line L; Copy path Copy permalink; BammyWahmmy Add files via upload. Latest commit f97ca36 Feb 2, 2018 History. 1 contributor Users who have contributed to this file 176 lines (173 sloc) 5.26 KB Raw Blame ..."
30,https://therealnews.com/battleground-baltimore-jan-29,"as the saying goes, ""exploit early, exploit often"". Comment by carriebot on 2020-12-17T13:04:40-06:00. It was only a matter of time, given there was no (or very very little) actual pvp happening. Comment by skumnasty on 2020-12-17T13:06:33-06:00"
31,https://www.ign.com/wikis/playerunknowns-battlegrounds/Cheats_and_Secrets,"Battleground Baltimore: Maryland shows solidarity with unionizing Amazon workers Police Union Conference in Baltimore Faces Protest Following Scathing DOJ Report Battleground Baltimore, Jan. 15"
32,https://eu.forums.blizzard.com/en/wow/t/epic-bg-premade-exploit/191733,PlayerUnknown's Battlegrounds drops players into a competitive survival battle where you'll engage in a heart-racing fight to be the last player left alive.
33,https://eu.forums.blizzard.com/en/wow/t/twinks-queue-exploiting/52276,"Epic bg premade exploit. PVP. Battlegrounds. Blood-twilights-hammer (Blood) October 11, 2020, 4:40pm #1. When is blizzard going to put the ban hammer on premades that exploting que for 40 man epic bgs, i can only do epic bgs on morning to work time. After work time i can't play anymore becouse russian exploiting split 8 man groups to que at ..."
34,https://www.cheat-god.com/cheats/free-playerunknowns-battlegrounds-cheat-pubg-hack-wallhack-aimbot-pc/,"Twinks & Queue Exploiting Bruneli-auchindoun May 26, 2019, 4:41pm #1 Recently, Blizzard divided non-120 battlegrounds into ''XP-on'' and ''XP-off'' categories. Following that, a large portion of the twinking community has resorted to using a particular macro to enter XP-on battlegrounds."
35,https://www.mpgh.net/forum/showthread.php?t=1374459,"Playerunknown's Battlegrounds Warnings are great, as they keep you aware of approaching enemies or dangers. If an enemie is aiming at you, a warning will appear, you can customize the messages that pop up to say whatever you'd like buddy! ... With this PUBG exploit, you are 100% protected in regard to BattlEye. Video Proof and Spectator ..."
36,https://robloxscript.guidesbloggers.com/dynasty-battlegrounds-infinite-energy/,"battleground stack exploit_mpgh.net.rar [Download and Thanks] (1.7 KB, 685 Downloads) Last edited by gaminggoose; 06-18-2018 at 06:40 AM. I have NO outside contact. Beware of impostors. Don't thank me, just hit thanks. The Following 88 Users Say Thank You to gaminggoose For This Useful Post: ..."
37,https://gameranx.com/features/id/152981/article/totally-accurate-battlegrounds-10-secrets-strategies-you-need-to-know/,"The Streets AIMBOT BYPASS [AIMBOT & AIMLOCK] Limited Simulator 2 AUTO BUY [NEW] Features Created by zxciaz#1337 Enjoy.... Read More November 12, 2020"
38,https://www.hearthstonetopdecks.com/hearthstone-battlegrounds-guide-best-strategies-compositions/,"Totally Accurate Battlegrounds is the funhouse mirror version of popular Battle Royale shooters like Fortnite and PUBG — and that's pretty refreshing when every waking hour, we're bombarded ..."
39,https://acegameguides.com/how-to-get-extra-time-in-hearthstone-battlegrounds/,"Similar to the Menagerie comp, the Battlecry setup mostly revolves around one unit: Crowd Favorite. Together with an early Brann Bronzebeard and some Nightmare Amalgams, you can easily exploit all the different Battlecry effects while buffing up your main threat."
40,https://wearedevs.net/exploits/,"Since I started learning Hearthstone Battlegrounds, I spend a lot of time watching many of the popular streamers on Twitch. Since I started learning it didn't take long for me to become aware of the ""disconnect bug"", which allows you to restart your client on difficult turns to get access to some additional time."
41,https://forums.elderscrollsonline.com/en/discussion/523152/exploit-with-relics-in-battlegrounds,"Slurp is a formidable competitor to all major exploits due to its vastly superior software integration, original codebase, and support. 499k+ downloads. Download. Multiple RBX Games. Usually, you are limited to having only one game open. With this, you can open as many games as you want. 100 games if you felt like."
42,https://www.ownedcore.com/forums/world-of-warcraft/world-of-warcraft-exploits/101847-best-battleground-exploit-one-macro-multi-functions.html,"Exploit with Relics in Battlegrounds . Leave a Reply. ... This fix should also help improve interactions with the Chaos Ball or Relics in Battleground game modes."" This happened to me with Volendrung as well. When this happens to players with the Chaos Ball on Xbox, they usually don't have any visual indicator, and don't take any damage from ..."
43,https://github.com/BammyWahmmy/ROBLOX-EXPLOIT-SCRIPTS/blob/master/Sex%20Script.txt,"THIS MY FRIST EXPLOIT POST THE BEST EVER BATTLEGROUND EXPLOIT! IT'S JUST ONE SIMPLE MACRO. ALL YOU NEED TO DO IS TO USE MY MACRO. /script AcceptBattlefieldPort(1, 1) /script AcceptBattlefieldPort(1, 0) HOW TO USE THE MACRO? Queue up battlegrounds when the 'Enter or Cancel' window pops up, Click the macro which will let you get in the battleground."
44,https://www.ownedcore.com/forums/world-of-warcraft/world-of-warcraft-exploits/312170-battleground-chooser-all-exploit.html,"ROBLOX-EXPLOIT-SCRIPTS / Sex Script.txt Go to file Go to file T; Go to line L; Copy path Copy permalink; BammyWahmmy Add files via upload. Latest commit f97ca36 Feb 2, 2018 History. 1 contributor Users who have contributed to this file 176 lines (173 sloc) 5.26 KB Raw Blame ..."
45,https://www.pcgamer.com/uk/hearthstone-battlegrounds-players-are-using-a-windows-firewall-exploit-to-get-extra-turn-time/,Thread: Battleground Chooser FOR ALL Exploit . Results 1 to 14 of 14 Thread Tools. 12-04-2010 #1 ...
46,https://exploitplay.com/category/other/page/2/,Hearthstone Battlegrounds players are using a Windows firewall exploit to get extra turn time By Tim Clark 4 months ago High-level players Slysssa and Kripparrian explain the problem and how to...
47,https://www.pcgamesn.com/playerunknowns-battlegrounds/pubg-exploit-invisible-no-circle-damage,"WWE 2K BATTLEGROUNDS The world of WWE is your battleground with all-new, over the top, in-your-face arcade action as your favorite WWE Superstars and Legends battle it out in outlandish… Read More The Sims 4"
48,https://www.worldtribune.com/dominion-voting-systems-tied-to-clintons-widely-used-in-battleground-states/,"Coming in second place in PlayerUnknown's Battlegrounds is always frustrating, but it's much worse when you hit the final circle and there's nobody there. Some players have noticed this ..."
49,http://www.wowexploits.com/,"Dominion Voting Systems tied to Clintons, widely used in battleground states By World Tribune on November 7, 2020. ... a vulnerability security experts say hackers could easily exploit. ..."
50,https://amiibodoctor.com/2020/07/17/how-to-play-patches-the-pirate-in-hs-battlegrounds/,"World of Warcraft is the biggest MMORPG game of all time with over 2 million paying customers blowing out Everquest 2 right out of the water. With so many people playing the game, there is a lot of competition whether you want the best PVP character in Battlegrounds or Warsong, or just making enough money to pay for the latest epic armor and weapons from Auction House!"
51,https://xpoff.com/threads/how-to-play-regular-bgs-with-xp-off-in-any-bracket.87919/,"By Spike, Regular Contributor As you may have figured out from the title, this is going to be a short article on how to play Patches the Pirate in Hearthstone Battlegrounds. Keep in mind that as I write this, it's mid-July 2020, so some information may be outdated by the time you read this. I'll…"
52,https://xpoff.com/threads/have-people-been-banned-for-using-queue-macro.88289/page-2,"The exploit has been fixed since the end of cataclysm/start of MOP. Countless people reported me and people I played with. Never heard of any of us get banned. However, the script macro was disactivated and no longer works. Click macros are legal in my books, as it says, just acts as a mouse click. Scripts are the nasty ones."
53,https://www.pcgamesn.com/playerunknowns-battlegrounds/pubg-sanhok-exploit,"So if you enter an XPON battleground and exploited the race condition so that you entered it with your XP turned off, it automatically turns your XP back on (and conveniently causes you to have wasted the 10 gold you spent in turning it off)."
54,https://charlieintel.com/destiny-2-season-of-the-chosen-battlegrounds-tips-tricks-guide/84304/,"The exploit occurs in a specific spot outside a building the Na Kham village, in the south-west corner of the map. In the spot, the texture of the ground and the actual collision box of that same ..."
55,https://gizmostimes.com/wintergrasp-max-rank-cheat-in-world-of-warcraft/,"Battlegrounds Tips & Tricks The Battleground events follow the same pattern, although the setting, mechanics, and enemies will vary. You'll need to start by destroying shield generators, face the boss, and kill a named enemy. You'll notice that Battlegrounds transpires in three parts."
56,https://www.e-ir.info/2020/10/05/the-inevitable-battleground-for-competing-powers-cyberwarfare/,"The daily battleground should be chosen and played over and over until there is a win. The extra marks from losses will be used later on to exchange for honor from the same battlemaster. Every two weeks or so, a player should have enough marks from all five battlegrounds to exchange them for 1241 honor per set of five different marks."
57,https://variety.com/2018/gaming/news/pubg-sanhok-exploit-1202863485/,The competition between global powers to make cyberspace the next battleground will have a serious consequence for the rest of the world if not addressed collectively. ... cyber operations could easily exploit the opportunity to create a civil disturbance with the spread of misinformation. If transnational non-state actors manage to get control ...
58,https://forum.elysium-project.org/topic/36568-alterac-valley-mass-exploit/,"""PlayerUnknown's Battlegrounds"" finally welcomed its new Sanhok map with an official debut on June 22 for PC users. It's only been available for a week or so, and players h…"
59,https://www.trueachievements.com/a309500/invincible-achievement,"Still it doesn't make us win the battleground, or gives us a huge benefit. It simply allows us to actually let us go into the alliance base in AV. ... They can skip the first two bunkers w/o exploit and still be fine with a race tactic given both teams have a few mages defending where it hurts the most. With exploit they can skip them all."
60,https://www.wowhead.com/guide=1413/battlegrounds-101-honor-made-easy,"In Battlegrounds, the eliminations are done mostly by mashing the triggers after Irish whipping () the opponent into the turnbuckle or over the ropes. Alternatively, if the opponent's health is low..."
61,http://www.bungie.net/en/Forums/Post/258701393,"Of all the things to do in the World of Warcraft, Battlegrounds have probably the most varied outcomes AND player bases. You get people from all niches, the hardcore raiders, the fresh 90's, casuals, and all levels of PvPers, from the part time battleground goer to the Gladiators and Heroes of the Horde/Alliance."
62,https://plarium.com/forum/en/stormfall-age-of-war/511_archive/17125_battlegrounds-spreadsheet/,"Exploit in the europa battleground i found a exploit in the left side of the first area, there is a shield or something like that to prevent players to go to the next area, but there is a spot where you can pass to the otherside and reach the last room before the other players destroy the first area shield."
63,https://www.wowhead.com/news/alterac-valley-battleground-hotfix-to-fix-abnormally-short-games-319986,":) I'm making my battlegrounds spreadsheet publicly available for everyone to use. The spreadsheet will tell you how to use battlegrounds, how to track your bank balance to get good payouts, and what are the best and most efficient troop types to use. It will allow you to keep track of all troops bonuses from lost arts, relics, paragon, etc."
64,http://www.pubgmobile.com/en-US/,"Blizzard has announced via the WarcraftDevs twitter that they are implementing a hotfix to address level 60 enemies inside the Alterac Valley PvP Battleground not properly scaling. Since the launch of Shadowlands, the Alterac Valley bosses Vanndar Stormpike and Drek'Thar have had very low health and damage, even when buffed by towers, resulting in extremely short games as players steamroll ..."
65,https://therealnews.com/battleground-baltimore-jan-29,"A hundred players will land on the battleground to begin an intense yet fun journey. Each player is required to scavenge survival supplies, as well as to exploit the maximum potential of the map terrain, vehicles, and items to become the last team standing on the battleground. Check your heartbeat and be on guard as the playzone begins to shrink."
66,https://www.metacritic.com/game/xbox-one/wwe-2k-battlegrounds,"Battleground Baltimore: Maryland shows solidarity with unionizing Amazon workers Police Union Conference in Baltimore Faces Protest Following Scathing DOJ Report Battleground Baltimore, Jan. 15"
67,https://virusscan.jotti.org/en-US/filescanjob/vd4s1l2vgk,"WWE 2K Battlegrounds is a good comeback for the saga, and leaving us with a fun game for fans and casuals. Much more arcade than any of its predecessors, a well-polished cartoon look and an entertaining combat make WWE 2K Battlegrounds a game you will want to try if you like fighting games."
68,https://roblox-elemental-battlegrounds.fandom.com/wiki/Explosion,"Name: battleground stack exploit.rar : Size: 1.7kB (1,743 bytes) Type: RAR archive data, v5 : First seen: June 18, 2018 at 12:16:58 AM GMT+2: MD5 ..."
69,https://www.hearthstonetopdecks.com/guides/hearthstone-battlegrounds-heroes-tier-list-guides/,"Explosion is a Superior Element in Elemental Battlegrounds. Its color palette consists of orange, red, white, and blue. Its medal depicts an explosion with a swirl in the middle. Explosion works best at close range, having defensive capabilities and Spells that can control the distance of the battle fairly consistently."
70,https://gamerant.com/pubg-sanhok-map-exploit/,"The Battlegrounds Perks are currently available for either in-game gold or for real money. Some Heroes are stronger than others, even significantly so. Nonetheless, it is possible to win games even on leaderboard ranks with any Hero. If you're having fun with a specific Hero, don't worry about its tier. That said, this tier list guide can ..."
71,https://www.pubgmobile.com/,"A new exploit is found in PlayerUnknown's Battlegrounds' new map, Sanhok, which allows players to completely disappear from view and easily get the jump on opponents."
72,https://hearthstone.fandom.com/wiki/Pogo-Hopper_(Battlegrounds),"A hundred players will land on the battleground to begin an intense yet fun journey. Each player is required to scavenge survival supplies, as well as to exploit the maximum potential of the map terrain, vehicles, and items to become the last team standing on the battleground. Check your heartbeat and be on guard as the playzone begins to shrink."
73,https://classic.wowhead.com/news/exit-portals-disabled-in-wow-classic-warsong-gulch-due-to-exploits-311171,"Battlecry: Gain +2/+2 for each other Pogo-Hopper you played this game.See this card on Hearthpwn Pogo-Hopper was a Tier 2 minion in the Battlegrounds game mode. Pogo-Hopper was one of the hardest cards to play in the game because its buff was heavily dependent on rolling itself multiple times. Pogo-Hopper builds were very RNG-reliant, and other scaling minions like Wrath Weaver and Rabid ..."
74,https://medium.com/chris-leckness/xp-off-twinks-in-xp-on-battlegrounds-does-blizz-need-to-fix-this-55688e71c62b,"Blizzard In approximately two hours, we will deploy a hotfix to all WoW Classic realms that disables the exit portals from Warsong Gulch. Thereafter, players who need to exit the battleground will have to use the other means of doing so: /AFK."
