num,url,text
151,https://www.militarytimes.com/news/your-army/2019/05/29/us-airstrikes-interrupt-isis-and-al-shabaab-battleground/,"State Republican Leaders Are Rushing to Exploit Trump's Big Lie. By Steve Col l. February 2, 2021 Save this story for later. ... to challenge election results in battleground states that Biden ..."
152,https://cronkitenews.azpbs.org/2020/01/22/dnc-sees-maricopa-voters-as-key-to-making-arizona-a-2020-battleground/,"The U.S. appears to be stepping up airstrikes in northern Somalia's Golis Mountains, where the country's Islamic State affiliate and al-Shabaab have been battling for territorial control."
153,https://pubmed.ncbi.nlm.nih.gov/20129784/,"The Democratic National Committee has identified Arizona as one of six battleground states, won by President Donald Trump in 2016, where it hopes to put the president on the defensive in 2020. Republicans say it's too little, too late. ... Bergstein said on other tool the program hopes to exploit is the unpopularity of President Donald Trump."
154,https://foodfirst.org/publication/agriculture-the-next-battleground-for-climate-justice/,Ubiquitin was first described as a tag allowing cells to degrade and recycle their own proteins. Recent research has shown ubiquitin to be central for immune system recognition of invading bacteria. This review describes a set of complex host-pathogen interactions that are dependent on ubiquitinatio …
155,https://www.reuters.com/article/us-cambodia-deforestation-politics-featu-idUSKBN22E016,"Industrial Ag's Climate Problem. Industrial farming is directly responsible for 14-24 percent of global greenhouse gasses (GHGs). 3 Half of all applied fertilizer ends up in the atmosphere or in local waterways. Livestock produces 18 percent of GHGs. 4 Deforestation, 70 percent of which is undertaken to make way for agriculture, constitutes another 18 percent of global emissions. 5 What we ..."
156,https://www.wowisclassic.com/en/guide/warsong-gulch/,"As loggers exploit virus, Cambodian forest protectors defy state ban. By Matt Blomberg. 6 Min Read ... and has become Cambodia's latest battleground for environmental defenders. ..."
157,https://clubdark.net/forum/d/49-booga-spawn-gui-still-works,"Battlegrounds, like raids, require a minimum of organization and coordination in order to strike effectively and win. These tips aren't very complex strategies but basics to master and use from the get go, especially if you're not a veteran and are new to WSG. 1. Designate a Flag Carrier"
158,https://www.commondreams.org/news/2020/03/06/warning-shot-our-party-sanders-says-trumps-latest-vow-cut-social-security-exposes,"--Made By Roadine -- Objects local BoogaHub = Instance.new(""ScreenGui"") local Main = Instance.new(""Frame"") local Title = Instance.new(""TextLabel"") local Jump ..."
159,https://www.governmentjobs.com/careers/cityofbg,"""Donald Trump tonight sent a warning shot to our party: if we nominate a candidate like Joe Biden who has repeatedly tried to cut Social Security and pushed disastrous trade deals, Trump will exploit that vulnerability in an effort to obscure his own record and win the battleground states that could swing the general election,"" said Shakir."
160,https://www.wowprogress.com/guild/us/area-52/Exploit,"Welcome to the City of Battle Ground's Employment Opportunities page. The City of Battle Ground is an Equal Opportunity . Employer does not unlawfully discriminate on the basis of race, sex, age, color, sexual orientation, religion, national origin, marital status, genetic information, veteran's status, disability, or any other basis prohibited by federal, state, or local law."
161,https://www.politico.com/story/2013/04/california-energy-fracking-battleground-090397,"About us: We are a late night mythic raiding guild with one common goal in mind- cutting edge. Castle Nathria is our first full tier together, as many of us came back in June 2020 and achieved 11/12M before taking some time off prior to Shadowlands in October."
162,https://www.zdnet.com/article/bitdefender-suffers-data-breach-customer-records-stolen/,The home of the Hollywood liberals is the nation's newest battleground on fracking. California is the latest state to embark on a fierce debate over whether and how to regulate the oil- and gas ...
163,https://www.space.com/thirty-meter-telescope-hawaii-volcano-maunakea-opposition.html,"Bitdefender suffers data breach, customer records stolen. A hacker is demanding $15,000 in payment or they plan to release customer details online."
164,https://www.thedailybell.com/all-articles/news-analysis/history-of-private-schools-public-schools-american-education-political-battleground/,The Thirty Meter Telescope: How a volcano in Hawaii became a battleground for astronomy. ... but many expressed concern about how humans have exploited and continue to exploit the planet.
165,https://imodexyt.wixsite.com/imodex,"Public schools in America go further back than the days of Jimmy Carter, with mandatory attendance for compulsory education dating back to the 19th century. Learn how American education went from private schools to mostly public, and how the state indoctrinates our youth."
166,https://accsports.com/acc-news/basketball/5-star-trevor-keels-sets-decision-date-battleground-recruit-for-duke-and-virginia/,This is the best website where you can get Free Scripts and Exploits without getting any virus and it's made by Professional Youtuber (iModex)
167,https://www.usnews.com/news/top-news/articles/2020-08-20/ballot-drop-boxes-are-latest-battleground-in-us-election-fight,5-star guard Trevor Keels will announce his college decision next month. Keels took to Twitter to state the April 4 will be his decision day. This is the Sunday of the Final Four weekend.
168,https://news.trust.org/item/20200502001910-su80w,"FILE PHOTO: A man wearing a mask to prevent the spread of coronavirus disease (COVID-19) casts his ballot for Maryland's primary election at a drop box in Rockville, Maryland, U.S., June 2, 2020."
169,https://gamingmodeon.com/roblox-troublesome-battlegrounds-2-codes/,"As loggers exploit virus, Cambodian forest protectors defy state ban. ... according to GFW data, and has become Cambodia's latest battleground for environmental defenders. ..."
170,https://retrowow.gg/forum/showthread.php?tid=18744,Roblox Troublesome Battlegrounds 2 Codes help you to get free rewards.Today we will be listing valid and working codes for Roblox Troublesome Battlegrounds 2 for our fellow gamers.We will also tell you how you can redeem these codes in Troublesome Battlegrounds 2.So stay tuned and just keep reading!
171,https://galaksizen.blogspot.com/2021/05/elemental-battleground-creation-create.html,1. Character name: [b] Illkhg [/b] 2. Reason: Terrain Exploit in battleground: WSG. (I am unable to attack even when using noggenfogger. He is using this to gain a unfair advantage.)
172,https://techcodex.com/krafton-fears-battlegrounds-mobile-india-ban-if-compared-to-pubg-mobile-content-creators-allege-intimidation/,"Elemental Battleground Creation : Create a Elemental battleground better tierlist Tier List .... Combos, elemental battlegrounds codes, elemental battlegrounds creation, elemental creation is a superior element in elemental battlegrounds. ... which make it really fun to exploit in the game! Roblox elemental battlegrounds auto skill creation ..."
173,https://charlieintel.com/crazy-warzone-exploit-gives-akimbo-sykov-pistols-zero-recoil-100-accuracy/94324/,"Last week, IGN India was the first to report that Krafton may have reached out to Indian content creators to ensure PUBG Mobile is not mentioned when referring to Battlegrounds Mobile India. Now, several content creators have reached out on condition of anonymity fearing retribution that this was indeed the case, confirming that Krafton had […]"
174,https://forums.bladeandsoul.com/topic/190532-distinguishing-bots-and-exploits/,"Crazy Warzone exploit gives Akimbo Sykov Pistols zero recoil & 100% accuracy. Although Warzone's Sykov will be nerfed soon, a new glitch is giving the Akimbo full-auto Pistols complete accuracy and no recoil. Published. 1 month ago. on. April 19, 2021. By. Liam Mackay."
175,https://www.techradar.com/news/pubg-news-and-updates-whats-new-in-playerunknowns-battlegrounds,"What are some less known distinguishing characteristics of arena bots and exploits in arena? Please tell us what to watch out for (visual/audible cues, descriptions, anything that may help). This question is mostly for the benefit of some who dont frequently do the arena. Some that I know of (and..."
176,https://www.matrixgames.com/forums/tm.asp?m=4970961,PlayerUnknown's Battlegrounds (or PUBG as it's commonly known) spearheaded the popularity of battle royale games.It was a breakout hit that inspired countless competitors such as Fortnite and ...
177,https://cheatautomation.com/pubg-lite-hack,Posts: 3480 Joined: 8/4/2010 From: Back in Blighty Status: offline 1 Axis navies just need to keep out of the way until the french fleet disappears 2 I think the UK in N. Africa is not what is meant to happen so it's a bug.
178,https://bloxhypeinc.com/2021/03/20/troublesome-battlegrounds-2/,"Win more matches than ever before with CheatAutomation's PUBG Lite cheat software for PC! This cheat designed for PUBG Lite on PC gives you an instant-on advantage to get you into the endgame of every match you play, with a precision bone aimbot and full player ESP.. Lock on to opponents for maximum accuracy with the aimbot, and with the player ESP, see the locations of all nearby players ..."
179,https://www.pubg.com/en-us/rules-of-conduct/,"Play TROUBLESOME Battlegrounds [KARS & KIRA + 3 MORE] TROUBLESOME Battlegrounds 2 - Roblox. Update Log: 5 New Characters! Kars Kira Stroheim Old Joseph Vanilla Ice. 2 New Maps! Volanic Island Ogre Street. Game still early in development, likely to be bugs."
180,https://gist.github.com/Arinerron/0e99d69d70a778ca13a0087fa6fdfd80,"Rules of Conduct. 1. General Rule. This Rules of Conduct regulate general matters that end users and company should comply with in relation to the services of PLAYERUNKNOWN'S BATTLEGROUNDS (hereinafter referred to as ""Game"") provided by PUBG CORPORATION (""PUBG"")."
181,https://roblox.cheatersallowed.com/2021/01/krnl.html,"The exploit in question can't run anything out of it's normal context, because SE for Android will catch it (darn you SELinux, ruining my dreams constantly since 1998), and the child/fork will run with standard UID."
182,https://scriptsrbx.com/allan/,"About Mikael Publisher ROBLOX | Cheaters Allowed is Giving you Free Exploit and Scripts, you can download them by clicking Get Script or Downloading it. We Didn't Provide Any Links or Files here. Thanks for Visiting Our Website and Enjoy!"
183,https://en.wikipedia.org/wiki/List_of_military_tactics,Allan Exploit is a level 6/7 lua executor/wrapper with instance caching that allows you to execute various scripts in ROBLOX including dex explorer and infinite yield. Allan X has no Linkvertise downloads or any FileDM downloads! I'll not use any download manager for this! The links leads you to a mega.nz file to download!
184,https://robloxscript.guidesbloggers.com/dynasty-battlegrounds-god-mode/,"Penetration of the center: This involves the creation of a gap in the enemy line and its exploitation.Two ways of accomplishing this are separating enemy forces and using a reserve to exploit the gap that forms between them (e.g. Battle of Chaeronea (338 BC), the first recorded use of the penetration of the center or having fast, elite forces smash at a specific point in the enemy line (an ..."
185,https://xpoff.com/,"Assassin SILENT AIM. Assassin SILENT AIM Features Created by Atta#4817 Enjoy. JOIN HIS DISCORD... Read More December 27, 2020"
186,https://roblox.fandom.com/wiki/Exploit,"XPOff, A World Of Warcraft Community. About us. XPOff is the result of a merge with our old home, Twinkinfo. The goal of the website is to function as the primary hub for our community, and it is currently a safe harbor for those of us interested in the ancient, but still very much alive art of twinking in World of Warcraft."
187,https://press.uchicago.edu/Misc/Chicago/465036.html,"An exploit is the use of glitches and software vulnerabilities in Roblox by a player to alter the gameor gameplay for an unfair advantage. Exploits have been defined as a form of cheating. Some exploits are in the form of programs or injectable DLL files, which explicitly break the Roblox TOS, and can lead to a permanent ban by Roblox. An example would be the popular ""Hacking GUIs"" in which ..."
188,https://www.engadget.com/2013-01-14-not-so-massively-exploits-updates-and-world-of-warcrafts-dot.html,"Battleground Chicago: The Police and the 1968 Democratic National Convention ©2004, 224 pages, 11 halftones, 3 maps Paper $16.00 ISBN: 978--226-46503-6 (ISBN-10: -226-46503-9) For information on purchasing the book—from bookstores or here online—please go to the webpage for Battleground Chicago."
189,https://www.bloomberg.com/news/articles/2020-06-27/republicans-worry-trump-can-t-exploit-his-strength-on-economy,Another exploit reared its head in Diablo III this week as it became known that players were abusing the votekick ... The battleground seems to be designed for 5v5 matches and features three lanes ...
190,https://shadowsploit1160.weebly.com/roblox-exploit-script.html,"Jun 27, 2020Republicans Worry Trump Can't Exploit His Strength on Economy By . Mario Parker ... A New York Times-Siena College poll of six battleground states released Thursday showed that 55% of registered ..."
191,https://www.brighttalk.com/webcast/16011/478318/hafnium-exchange-exploit-is-patching-enough,"with this script you can kill all, Kill Aura and other OP commands in Prison Life, make other players mad and have fun :D to execute this script recommended to use Paid Exploit example: Synapse X, SirHurt, etc. but you can enjoy it with free exploit too, but some features may not work properly."
192,https://hothardware.com/news/destiny-2-season-of-the-chosen-how-to,"The battleground for advanced attacks has moved into application workloads and is being fought in runtime. Most people think of Zero Trust in relation to access controls for users, devices, and networks. But Zero Trust at runtime goes deep into the application workloads, where the attack surface has moved."
193,https://www.pubg.com/en-us/category/esports-en-us/,The Battleground activity will appear as a three-player match made under the existing strike playlist. Guardians will be rewarded with one Trial Chest after the boss has been defeated.
194,https://www.sikktech.com/pubg-mobile-injector-download.html,"PUBG Continental Series 3 Broadcasting channels, talent and more. Hello PUBG Esports fans! IT'S TIME. The PUBG Continental Series 3 (PCS3) is right around the corner and the exhilarating journey is about to begin!"
195,https://www.militarytimes.com/news/your-army/2019/05/29/us-airstrikes-interrupt-isis-and-al-shabaab-battleground/,PUBG Mobile Injector is a tool that consists of hacks and mods. This tool helps user or hackers to exploit the game by injecting the mods and cheats. This will help users to rank first in the game and win the game title easily.
196,https://natemodzexploits.weebly.com/strucid-aimbot-nov-21.html,"The U.S. appears to be stepping up airstrikes in northern Somalia's Golis Mountains, where the country's Islamic State affiliate and al-Shabaab have been battling for territorial control."
197,https://www.washingtontimes.com/news/2021/apr/15/democrats-led-by-a-whole-squad-of-ghoulish-opportu/,NATEMODZ EXPLOITS. Home Scripts My Channel REQUEST Exploits STRUCID AIMBOT GUI . GET SCRIPT. Powered by Create your own unique website with customizable templates. Get Started. Home Scripts My Channel REQUEST Exploits ...
198,https://cronkitenews.azpbs.org/2020/01/22/dnc-sees-maricopa-voters-as-key-to-making-arizona-a-2020-battleground/,"Apr 15, 2021Democrats led by a whole Squad of ghoulish opportunists. Ilhan Omar, Alexandria Ocasio-Cortez and Rashida Tlaib weigh in on death of Daunte Wright"
199,https://www.psxhax.com/threads/ps-phwoar-host-menu-v1-4-by-leeful-with-latest-ps4-exploit-payloads.7188/page-16,"The Democratic National Committee has identified Arizona as one of six battleground states, won by President Donald Trump in 2016, where it hopes to put the president on the defensive in 2020. Republicans say it's too little, too late. ... Bergstein said on other tool the program hopes to exploit is the unpopularity of President Donald Trump."
200,https://in.ign.com/playerunknowns-battlegrounds-mobile/159053/news/battlegrounds-mobile-india-ban-pubg-mobile-krafton-content-creator-intimidation,"A few months ago we saw a WIP design preview of his PS4 Exploit Host Menu, and today PlayStation 4 homebrew developer @Leeful released PS-Phwoar! Host Menu v1.0 followed by PS-Phwoar!Host Menu v1.1, PS-Phwoar!Host Menu v1.2, PS-Phwoar!Host Menu v1.3 and PS-Phwoar!Host Menu v1.4 via Twitter featuring the latest PS4 exploit payloads for jailbroken PS4 5.05 consoles!"
201,https://en.wikipedia.org/wiki/2020_United_States_federal_government_data_breach,"With Battlegrounds Mobile India pre-registration, release date, and possible gameplay trailer on the way, Krafton is pulling out all the stops to prevent any content creator from even referring to ..."
202,https://apps.apple.com/us/app/pubg-mobile-traverse/id1330123889,"In 2020, a major cyberattack by a group backed by the Russian government penetrated thousands of organizations globally including multiple parts of the United States federal government, leading to a series of data breaches. The cyberattack and data breach were reported to be among the worst cyber-espionage incidents ever suffered by the U.S., due to the sensitivity and high profile of the ..."
203,https://english.alarabiya.net/views/2021/03/16/Iran-s-crossroad-The-Taliban,"The official PLAYERUNKNOWN'S BATTLEGROUNDS designed exclusively for mobile. Play free anywhere, anytime. PUBG MOBILE delivers the most intense free-to-play multiplayer action on mobile. Drop in, gear up, and compete. Survive epic 100-player battles, and fast-paced 4v4 team deathmatch and zombie modes. Survival is key and the last one standing wins."
204,https://www.infosecurity-magazine.com/news/multiple-apt-groups-exploit-pulse/,Iran's next battle ground: Afghanistan URL Copied ... Some might look at the lifting of sanctions as leeway for Tehran to regain more resources to exploit and further empower and arm its ...
205,https://www.commondreams.org/news/2020/03/06/warning-shot-our-party-sanders-says-trumps-latest-vow-cut-social-security-exposes,"Pulse Secure customers have been urged to take immediate steps to mitigate a critical zero-day vulnerability in the popular VPN platform, after researchers revealed multiple APT groups are targeting it."
206,https://store.steampowered.com/app/823130/Totally_Accurate_Battlegrounds/,"""Donald Trump tonight sent a warning shot to our party: if we nominate a candidate like Joe Biden who has repeatedly tried to cut Social Security and pushed disastrous trade deals, Trump will exploit that vulnerability in an effort to obscure his own record and win the battleground states that could swing the general election,"" said Shakir."
207,https://en-forum.guildwars2.com/discussion/39021/exploit-on-eternal-battlegrounds,"Totally Accurate Battlegrounds Grab your balloon crossbow and trusty inflatable hammer, because things are about to get wobbly! Be the last weirdo standing in the world-leading physics-based Battle Royale game."
208,https://www.zdnet.com/article/bitdefender-suffers-data-breach-customer-records-stolen/,"My point is i already send an email to [email protected] 4 Months ago, i even offered to show it ingame in case there would be problems. But i never heard back and the exploit is still ingame. I also opened a support ticket a couple days ago, but havent heard back yet."
209,https://www.forcepoint.com/cyber-edu/zero-day-exploit,"Bitdefender suffers data breach, customer records stolen. A hacker is demanding $15,000 in payment or they plan to release customer details online."
210,https://n4g.com/news/2183870/pubgs-sanhok-map-exploit-needs-to-be-fixed,"Exploits can go unnoticed for years and are often sold on the black market for large sums of money. These exploits are considered ""zero-day"" before and on the day that the vendor is made aware of the exploit's existence, with ""zero"" referring to the number of days since the vendor discovered the vulnerability. ""Day zero"" is the ..."
211,https://www.sirhurt.net/,"A new exploit is found in PlayerUnknown's Battlegrounds' new map, Sanhok, which allows players to completely disappear from view and easily get the jump on opponents. PC Playerunknown's Battlegrounds PS4 Xbox One gamerant.com. Read Full Story >> gamerant.com."
212,https://www.realclearpolitics.com/2021/02/26/democrats_exploit_nationrsquos_crisis_for_partisan_spending_spree_536917.html#!,"Asshurt is one of the most reliable tools on the market. Asshurt has expanded from beyond just a simple roblox cheat/roblox exploit/roblox hack with uses that expand farther than just a roblox exploit. It comes with a script executor! For the uses of this product, and its price, this program is a steal! We not only provide roblox exploits, but we are also a digital-games marketplace, providing ..."
213,https://www.usnews.com/news/top-news/articles/2020-08-20/ballot-drop-boxes-are-latest-battleground-in-us-election-fight,"Democrats Exploit Nation's Crisis for Partisan Spending Spree New York Post , New York Post February 26, 2021 President Biden claims his $1.9 trillion COVID-19 relief package is a matter of life ..."
214,https://thenewamerican.com/texas-sues-4-battleground-states-at-scotus-to-block-tainted-votes-from-being-counted/,"FILE PHOTO: A man wearing a mask to prevent the spread of coronavirus disease (COVID-19) casts his ballot for Maryland's primary election at a drop box in Rockville, Maryland, U.S., June 2, 2020."
215,https://hearthstone.fandom.com/wiki/Zapp_Slywick,"Texas Sues 4 Battleground States at SCOTUS to Block ""Tainted"" Votes from Being Counted. ... Follow his exploits on Facebook, Twitter, and Parler at @LuisMiguelUS. Contact at luisantoniomiguel.com."
216,https://www.amazon.com/Cyber-Warfare-Strategies-organization-battleground/dp/1839216999,WindfuryThis minion always attacks the enemy minion with the lowest Attack.See this card on Hearthpwn Zapp Slywick is a Tier 6 minion in the Battlegrounds game mode. 1 Strategy 2 Quotes 3 Lore 4 Trivia 5 Gallery 6 Patch changes Zapp Slywick is best placed on the very left of your board in order to attack first. It is useful to tech this minion into your board to snipe your opponent's key ...
217,https://www.esportstalk.com/news/krafton-reportedly-concerned-about-battlegrounds-mobile-india-being-banned/,"Cyber Warfare - Truth, Tactics, and Strategies: Strategic concepts and truths to help you and your organization survive on the battleground of cyber warfare [Cunningham, Dr. Chase] on Amazon.com. *FREE* shipping on qualifying offers. Cyber Warfare - Truth, Tactics, and Strategies: Strategic concepts and truths to help you and your organization survive on the battleground of cyber warfare"
218,https://legitguy.com/gaming/krafton-fears-battlegrounds-mobile-india-ban-if-compared-to-pubg-mobile-content-creators-allege-intimidation/,"Krafton, the parent company behind the PUBG series, recently revealed that PUBG Mobile is returning to India, but under a new moniker and style with Battlegrounds Mobile India. The ""new"" mobile battle royale title will attempt to circumvent the original game's ban , but it has a tough road ahead of it."
219,https://www.skynewskashmir.com/2021/05/battlegrounds-mobile-india-playstore.html,"Last week, IGN India was the first to report that Krafton may have reached out to Indian content…"
