num,url,text
75,https://www.ncbi.nlm.nih.gov/pubmed/20129784,"Yes, in XP On battlegrounds, level 10s are staying at level 10 while their opponents are level from 10-14. ... but it still needs to be addressed by Blizzard. This exploit has been out there for ..."
76,https://www.facebook.com/Roblox-Exploits-and-Scripts-465553633928084/?__xts__=Array,"Cytosol as battleground: ubiquitin as a weapon for both host and pathogen. Collins CA(1), Brown EJ. Author information: (1)Medical Scientist Training Program, University of California San Francisco, San Francisco, CA 94143-0662, USA. Ubiquitin was first described as a tag allowing cells to degrade and recycle their own proteins."
77,https://www.cyberark.com/resources/blog/it-s-identity-management-day-16-stats-from-the-new-cybersecurity-battleground,Roblox Exploits and Scripts. 569 likes · 1 talking about this. Blogger
78,https://kotaku.com/popular-battlegrounds-streamer-banned-after-exploiting-1797725299,"Today is Identity Management Day - a U.S. awareness initiative presented by the National Cybersecurity Alliance and the Identity Defined Security Alliance (IDSA). In the midst of a dramatic technological and economic shift, this push to educate business leaders, IT decision makers and the general public about the importance of managing and securing identities comes at the perfect time."
79,https://www.warcraftmovies.com/movieview.php?id=34710,"After foretelling it, Destiny was, in fact, promptly banned from Battlegrounds. It seemed he was brazenly using exploit where houses didn't load in his game to get the best of his opponents, who he..."
80,https://www.elitepvpers.com/forum/pubg-hacks-bots-cheats-exploits/,"Battle Ground Exploits 2.0.1 by pejamas. 2007-01-10. ... was available to me before the upcoming expansion i decided to ""explore"" most of the old and some of the newer bugs/exploits in the battle grounds to see if they were still doable in the latest ( 2.0.1 ) patch, most of them were. ..."
81,https://www.theguardian.com/environment/2016/sep/17/arctic-exploitation-battleground,"Get or release your PUBG Hacks, Bots, Cheats & Exploits here. [no questions] Here you will find a list of discussions in the PUBG Hacks, Bots, Cheats & Exploits forum at the PlayerUnknown's Battlegrounds category."
82,https://anonymouscheats.net/hacks/pubg-aimbot-wallhack/,"Sep 17, 2016The Arctic is heating up in meteorological, political and environmental terms as nations fall over themselves to exploit the region. Apart from Denmark's rebuff of Russia's Arctic overtures, ..."
83,https://www.ign.com/wikis/mass-effect/Max_Paragon_and_Renegade_Exploit,"Run PlayerUnknown's BattleGround on your PC. Tab out from the game and double click on ""anonymouscheats-PUBG-hack.v3.7.exe"". Go back to PlayerUnknown's BattleGround and press the F3 button to load the hack menu. PS4 Instructions. In order to use the PUBG hack on PS4, you'll need an empty USB flash drive to put the hack on."
84,https://root-helper.com/roblox-troublesome-battlegrounds-2-codes/,"For this exploit, you'll need to have bought 5 Charm Points or 5 Intimidate Points in the Squad Menu. Each is associated with a particular Morality: Paragon for Charm and Renegade for Intimidate."
85,https://forward.com/opinion/417058/opinion-the-surprising-new-battleground-in-the-war-against-palestinian/,"The long-awaited sequel of Troublesome Battlegrounds, TB2 provides players with the ultimate experience, providing you with action packed team battles in a variety of settings. Game still early in development, likely to be bugs. Exploit at your own risk. We do not appeal bans."
86,https://robxploits.site123.me/,"But the Airbnb lawsuit is interesting for the context that gave rise to it: an ongoing and expanding campaign that seeks to exploit America's laws, regulations, courts, and financial systems as ..."
87,https://www.facebook.com/Roblox-Exploits-and-Scripts-465553633928084/?__xts__=68.ARCTI5oH0Uk...,"Our exploits Have the best Roblox Exploit UI/User Interface. It also have a lot of features that other Exploit doesn't have. Lua Script Executor. Our exploits are the one of the best Roblox lua script executor ever made! can execute almost all script. It can run scripts like 'Infinite Yield', 'c00lkidd gui', 'Ro-Xploit' & more."
88,https://ro-exploits.glitch.me/,Roblox Exploits and Scripts. 570 likes · 2 talking about this. Blogger
89,https://www.elitepvpers.com/forum/playerunknowns-battlegrounds/,Ro-Exploits l Roblox Exploits & Hack Scripts
90,https://battlelog.co/pubg-hacks/,"Download or share your PlayerUnknown's Battlegrounds hack at world's leading forum for all kind of PlayerUnknown's Battlegrounds hacks, cheats and aimbots. Here you will find a list of discussions in the PlayerUnknown's Battlegrounds forum at the Popular Games category."
91,https://www.pubg.com/en-us/2020/03/11/update-6-3/,"Playerunknown Battlegrounds Hacks - How we keep them safe. As we at Battlelog.co are striving to make our customers happy, we always do what we can to keep the pubg hacks safe from detection. Our private hacks are hand-picked from a big selection of coders, where we test them for weeks to make sure they are safe."
92,https://twitter.com/Elements_RBLX,"Most instances of this exploit have been resolved, although in some uncommon situations the exploit can still be performed. ... While a powerful AoE damage tool on the Battlegrounds, there are some drawbacks to picking the Panzerfaust up. First of all, it takes up a primary weapon slot, limiting your options on the diverse terrain of Karakin ..."
93,https://www.goodreads.com/book/show/51816163-battlegrounds,We would like to show you a description here but the site won't allow us.
94,https://cis.org/Bensman/Ecuador-Unlikely-Battleground-Secure-Americas-Southern-Border,"Battlegrounds starts off well with an objective of presenting a national security perspective of America's current and future challenges, colored as he describes by the lessons of the past. ... of civility in public discourse can reduce the vitriol that widens the fissures in society that Russia and others exploit. ..."
95,https://www.techspot.com/news/89518-new-spectre-vulnerability-costly-patch-but-nearly-impossible.html,"The Center for Immigration Studies is an independent, non-partisan, non-profit research organization founded in 1985. It is the nation's only think tank devoted exclusively to research and policy analysis of the economic, social, demographic, fiscal, and other impacts of immigration on the United States."
96,https://steamcommunity.com/sharedfiles/filedetails/?id=122277141,"A new Spectre vulnerability is costly to patch but nearly impossible to exploit Will Spectre haunt CPUs forever? By Isaiah Mayersen on May 2, 2021, 9:51 13 comments"
97,https://www.thegamer.com/destiny-2-chosen-title-guide/,"@MeanMan, that's an exploit. Bennet's infinitly respawning bars are clearly a bug and not an intended feature. You might as well just use a console to spawn yourself the bards, or just gold. MeanMan Feb 22, 2018 @ 2:42am Good guide, but you got one think wrong. Blacksmith gives you the most Gold, since you can buy infinite Steel bars From ..."
98,https://www.geoad.org/elemental-grind-game-scripts/,"Destiny 2's Season of the Chosen has introduced an array of new guns, perks, and new armor mods for Guardians to chase. Farming for the best rolls on items can take an eternity, so why not mix up that grind by chasing a title?. RELATED: Destiny 2 Season Of The Chosen: All Week 5 Seasonal Challenges Season 13's Chosen title is one of the easiest titles to earn in Destiny 2."
99,https://www.theorganicprepper.com/cyber-warfare/,"Elemental Battlegrounds is a game made by the development group Gamer Robot on December 5, 2016. It is the sequel to Elemental Wars.. Gameplay. This game is a skill/level based PvP game. This game is the sequel to Elemental Wars, a game which was created 2 months before Elemental Battlegrounds. The two games showing similar abilities, controls ..."
100,https://plantsvszombies.fandom.com/wiki/Backyard_Battleground,"It may make you wonder whether cyber warfare is the battleground of the future. Microsoft says the attack has claimed at least 60,000 victims-many of them small businesses This attack, which focused on email software, has become a global cybersecurity emergency, as hackers are racing to infect as many people as possible before companies can ..."
101,https://www.thehindu.com/news/cities/kolkata/west-bengal-assembly-polls-high-decibel-divide-in-battle-ground-seat/article34045966.ece,"Backyard Battleground is the hub area in Plants vs. Zombies: Garden Warfare 2 where the player can do quests to level up with the new ranking system, join up with friends, enter game modes and mission portals, and buy sticker packs."
102,https://www.technotification.com/2021/05/stay-away-from-pubg-mobile-india-bgmi-fraud-links-to-apk-files.html,"Trinamool Congress supporters praying for the speedy recovery of party chief and West Bengal CM Chief Minister Mamata Banerjee, outside SSKM hospital, in Kolkata on March 11, 2021."
103,https://www.forbes.com/sites/janakirammsv/2015/06/26/amazon-echo-just-turned-your-living-room-into-a-battleground/,"For Battlegrounds Mobile India, Hackers built a fake APK connection that runs across the Internet. Hackers circulate bogus Battlegrounds Mobile India APK download links for Android devices according to new media sources. If you transfer these APK files to your laptop, be sure to steal your personal data and then exploit it for financial gains."
104,https://www.forbes.com/sites/andriacheng/2019/02/20/under-armours-new-battleground-against-nike-adidas-goes-beyond-the-u-s/,"Jun 26, 2015Amazon Echo was announced in November last year with the initial release limited to a select few individuals and Amazon Prime members. Much like Apple Siri and Microsoft Cortana, Amazon Echo is a ..."
105,https://nationalinterest.org/blog/reboot/deadliest-battleground-ever-korean-dmz-literal-minefield-179664,"Feb 20, 2019Under Armour has trailed behind larger rivals Nike and Adidas in recent years, failing to respond fast enough to the hot athleisure trend in the U.S., but it's hoping the growing sports business ..."
106,https://www.talkesport.com/news/battlegrounds-mobile-india-new-rules-and-restrictions/,"Deadliest Battleground Ever? The Korean DMZ is a Literal a Minefield Any invading force would have to contend with secret tunnels, mines, and 1.2 million armed men and women."
107,https://wowwiki-archive.fandom.com/wiki/Arathi_Basin,Battlegrounds Mobile India will only be made available to a very limited amount of time and after a proper consent of their guardians. Those who may try to exploit this system and register without consent cannot completely evade these restrictions as the guardians can contact Krafton and request for information clean-up as well.
108,https://www.helpnetsecurity.com/2017/06/27/cybersecurity-battleground-shifting-linux/,"Located in Arathi Highlands, Arathi Basin is a fast and exciting battleground. The Basin itself is rich with resources and coveted by both the Horde and the Alliance. The Forsaken Defilers and the League of Arathor have arrived at Arathi Basin to wage war over these natural resources and claim them on behalf of their respective sides. It is similar to ""King of the Hill,"" ""Conquest,"" or ..."
109,https://gist.github.com/irancore/10913800,"The cybersecurity battleground is shifting toward web servers. ... Attackers still exploit the Android StageFright flaw. This exploit first gained notoriety in 2015, and is proving its longevity ..."
110,https://www.blizzard.com/en-us/download/confirmation?id=hs&locale=enUS&platform=windows&gs_ref=playhearthstone,Crossfaction Battlegrounds For Last Revision Trinity - crossfaction.patch
111,https://www.historynet.com/how-north-africa-became-a-battleground-in-world-war-ii.htm,Download games and applications from Blizzard and partners.
112,https://www.nationalreview.com/corner/is-impeachment-hurting-democrats-in-battleground-states/,The battle for North Africa was a struggle for control of the Suez Canal and access to oil from the Middle East and raw materials from Asia. Oil in particular had become a critical strategic commodity due to the increased mechanization of modern armies.
113,https://www.cbsnews.com/news/h-r-mcmaster-battlegrounds-china-afghanistan-national-security-60-minutes-2020-09-20/,"In each of these battleground states, ... Hamas's decision to exploit the unrest in Jerusalem and shoot rockets into the highly populated Tel Aviv area is likely to trigger a forceful response. ..."
114,https://www.mckinsey.com/business-functions/marketing-and-sales/our-insights/the-new-battleground-for-marketing-led-growth,H.R. Mcmaster was an eyewitness to the Oval Office tempest that forms President Trump's foreign policy. McMaster was national security adviser for 13 months beginning in 2017 and he brought a ...
115,https://www.jsonline.com/story/news/politics/elections/2020/10/02/trumps-positive-test-upends-campaign-cuts-short-battleground-trips/5881375002/,"The new battleground for marketing-led growth. Open interactive popup. Article (PDF -224KB) ... By contrast, marketing geared to growing initial consideration will exploit a more diverse and wider set of consumer segments, many with limited or perhaps even no experience with the brand. The name of the game is expanding your window for growth ..."
116,https://www.businesswire.com/news/home/20200203005748/en/McAfee-Research-Reveals-Election-Website-Security-Shortcomings,President Trump's positive test upends campaign and cuts short an aggressive travel schedule in Wisconsin and other battlegrounds. ... styles and appeared eager to exploit the contrast between its ...
117,https://www.bustle.com/p/thrillers-have-always-been-a-feminist-battleground-were-just-finally-noticing-it-again-8871332,McAfee Research Reveals Election Website Security Shortcomings in 2020 Battleground States ... versus a focus on the implications that they could be spoofed to exploit the communities they serve ...
118,https://www.haaretz.com/israel-news/.premium-israel-elections-a-battleground-between-liberal-democracy-and-its-enemies-worldwide-1.7658066,"Thrillers Have Always Been A Feminist Battleground — We're Just Finally Noticing It Again. Anne Marie Fox/HBO. By Sadie Trombetta. July 27, 2018. ... not exploit, women's issues. ..."
119,https://sloanreview.mit.edu/article/lessons-from-chinas-digital-battleground/,"Israel Now a Key Battleground in the Global Clash of Liberal Democracy and Its Enemies . Netanyahu is calling in unprecedented re-election favors (read: interventions) from his illiberal brothers - Trump, Putin, Modi, Bolsonaro and Orban. The gloves are coming off in the conflict between liberals and illiberals in Israel - and around the world"
120,https://feelersrage.blogspot.com/2021/05/elemental-battleground-creation.html,"The explosive growth of the digital market in China, a country with more than 700 million internet users, constitutes a rich prize to companies that can exploit its opportunities. Five of the 10 largest public internet companies in the world — Tencent Holdings Ltd., Alibaba Group Holding Ltd., Baidu Inc., JD.com Inc. (aka Jingdong), and ..."
121,https://arenalbmxvideos.blogspot.com/2021/05/elemental-battleground-creation-games.html,"Elemental Battleground Creation / Elemental Battlegrounds Combat Tier Tier List Community Rank Tiermaker - Creation is a superior element in elemental battlegrounds.. Creation is a superior element in elemental battlegrounds. Its color palette consists of shining bright white, a deep purple with a little bit of blue."
122,https://policesirensaudio.blogspot.com/2021/05/elemental-battleground-creation.html,"Roblox elemental battlegrounds auto skill creation elements for elemental battlegrounds wiki fandom. This new script for elemental legends has tons of op & dope features, which make it really fun to exploit in the game! Elemental battlegrounds is a first person pvp game on roblox made by a team of. Source: tr.rbxcdn.com"
123,https://www.techdirt.com/articles/20210517/09524046814/g7-technical-standards-blink-you-might-have-missed-new-battleground.shtml,"Elemental battleground creation / elemental hero stardust by alanmac95 on deviantart.all elemental power simulator codes. Source: basic-tutorials.de. Elemental battleground creation / frost giant with battle axe, elemental power mage of spell. Source: lparchive.org. Creation is a superior element in elemental battlegrounds."
124,https://www.eurasiareview.com/23052021-extremists-exploit-anger-over-delays-in-marawis-rebuilding-philippine-experts-say/,"Amid all the news about the third wave of the COVID-19 Pandemic and the politics behind the vaccination roll out, you might have missed the Ministerial Declaration from the G7 Digital and ..."
125,https://cul-chicago.org/hearthstone-battlegrounds-players-are-using-a-windows-firewall-exploit-to-get-extra-turn-time/,"Extremists Exploit Anger Over Delays In Marawi's Rebuilding, Philippine Experts Say . May 23, 2021 May 23, 2021 BenarNews 0 Comments. ... the main battleground, remained closed to civilians."
126,http://www.bankofwow.com/article/360.html,"I won't explain exactly how the exploit works for obvious reasons, but you can find the method online easily enough. Unsurprisingly, it's particularly prevalent in high MMR lobbies. I spoke to Slysssa and Kripparian, two of the best Battlegrounds streamers in the world, about the problem. ""It feels like every game that tokens are ..."
127,https://variety.com/2018/gaming/news/pubg-sanhok-exploit-1202863485/#!,priest/paladin ctf battlegrounds exploit. priest/paladin ctf battlegrounds exploit. Search Guides: All World of Warcraft Guides: If you can put together a team of a Paladin and Priest in CTF BG you can easly force the horde flag carrier drop the flag without killing him. 1. Have the priest cast mind control on the flag carrier.
128,https://mmo-worlds.blogspot.com/2009/04/leave-battleground-without-deserter.html,"By Brittany Vincent ""PlayerUnknown's Battlegrounds"" finally welcomed its new Sanhok map with an official debut on June 22 for PC users. It's only been available for a week or so, and players have..."
129,https://roblox.fandom.com/wiki/Exploit,Leave Battleground without Deserter Buff Exploit -... Arathi Basin Beginner Strategy and Tactic Tips - W... Become unattackable in PvP - World of Warcraft; Train Weapon Skill while AFK with no risk of dying... Win Wintergrasp in 5 minutes Exploit Tactic - Worl... Chopper/Mammoth speed/no-dismount Exploit - World ...
130,https://gamefaqs.gamespot.com/pc/470395-star-wars-galactic-battlegrounds/cheats,"An exploit is the use of glitches and software vulnerabilities in Roblox by a player to alter the gameor gameplay for an unfair advantage. Exploits have been defined as a form of cheating. Some exploits are in the form of programs or injectable DLL files, which explicitly break the Roblox TOS, and can lead to a permanent ban by Roblox. An example would be the popular ""Hacking GUIs"" in which ..."
131,https://store.steampowered.com/app/823130/Totally_Accurate_Battlegrounds/,"For Star Wars Galactic Battlegrounds on the PC, GameFAQs has 23 cheat codes and secrets."
132,https://imodexyt.wixsite.com/imodex/scripts,"Totally Accurate Battlegrounds Grab your balloon crossbow and trusty inflatable hammer, because things are about to get wobbly! Be the last weirdo standing in the world-leading physics-based Battle Royale game."
133,https://www.washingtontimes.com/news/2021/feb/22/chinese-hackers-tried-exploit-americans-copying-na/,Exploits. More. iModex. MINING SIMULATOR ROBLOX HACK / SCRIPT. Click here to get the Script. SPEED CHAMPIONS ROBLOX HACK / SCRIPT. Click here to get the Script. BLADE THROWING SIMULATOR ROBLOX HACK / SCRIPT. Click here to get the Script. MURDER MYSTERY 2 ROBLOX HACK / SCRIPT.
134,https://www.merriam-webster.com/dictionary/exploits,"Feb 22, 2021""The exploit was replicated by the APT during 2014 to form 'Jian' and used since at least 2015, until finally caught and patched in March 2017,"" wrote Eyal Itkin and Itay Cohen, Check ..."
135,https://rscripts.net/scripts,"Exploit definition is - deed, act; especially : a notable, memorable, or heroic act. How to use exploit in a sentence. Synonym Discussion of exploit."
136,https://rdmscript.weebly.com/script-free.html,"This new Script for Lucky Blocks Battlegrounds allows you to open all Blocks Blocks at once. Made by gottepotte420, enjoy! Muscle Legends GUI (ThunderHub) May 22, 2021 zerpqe#4617 & light.zki#3552 41 views. This new Script for Muscle Legends comes with some really neat Features and looks sick. Made by zerpqe#4617 & light.zki#3552. enjoy!"
137,https://threetrackmind.wordpress.com/2021/03/13/semantic-battleground-clash-of-the-neurogangs/,Lucky Block Battlegrounds Open Rainbow Block Free Working. GetHere. Dungeon Quest Auto Farm Gui lv1-59 Key Cracked Working. GetHere. Eyherious Online Gui Auto Farm/Auto Quest/AND MORE working. GetHere. Jailbreak Auto Rob AND/More Working. GetHere. Troublesome ...
138,https://www.forcepoint.com/cyber-edu/zero-day-exploit,"Before we get into this one, I'd just like to disclose my personal opinion that the term ""identity politics"" is dismissive, condescending bullshit. The fact that people from marginalized groups have a vested interest in collaborating to promote their own political interests is not ""identity politics,"" it's self-advocacy. And to preempt any bullshit, let me…"
139,https://economictimes.indiatimes.com/news/defence/india-is-fighting-the-doklam-war-with-china-on-a-5-inch-battleground/articleshow/60192637.cms,"Exploits can go unnoticed for years and are often sold on the black market for large sums of money. These exploits are considered ""zero-day"" before and on the day that the vendor is made aware of the exploit's existence, with ""zero"" referring to the number of days since the vendor discovered the vulnerability. ""Day zero"" is the ..."
140,https://wowpedia.fandom.com/wiki/Premade,"The government has responded to these security risks with a flurry of moves in the past few days. The Ministry of Electronics and IT has directed 21 smartphone makers, most of which are Chinese, to inform it about the procedures and processes they follow to ensure the security of mobile phones sold in India, following reports of data leakage and theft. The government will verify the details ..."
141,https://www.fastcompany.com/90469445/inside-the-2020-campaign-messaging-war-thats-pelting-our-phones-with-texts,"While regular battlegrounds randomly select players from numerous realms, premades join battlegrounds as a group. This function can be used to simply allow friends to enjoy playing together, or to arrange for a devastating tour de force from a highly organised and well-equipped team."
142,https://www.sikktech.com/free-script-pubg-mobile-hack-antiban.html,"As November approaches, some voters-especially in battleground states-might start feeling some fatigue at getting so many text messages from so many campaigns, parties, and PACs."
143,https://thediplomat.com/2018/02/malaysias-general-election-the-battleground-states/,Script pubg mobile file for the latest version of PUBG Mobile 1.4 is available now you can download the new updated script from the below download. New latest version of PUBG Mobile hack script is best and have some great features that would help in you reaching your next tier. This latest version of PUBG Mobile hack script 1.4 is officially launched for the gamers who want to cheat or exploit ...
144,https://imodexyt.weebly.com/,Malaysia's General Election: The Battleground States ... seeks to exploit his support base in the eastern part of Sabah to make momentous inroads in the East Malaysia state. But unlike other ...
145,https://www.pubg.com/en-us/category/esports-en-us/,Here you can find Scripts and Exploits for free and without getting any virus! About iModex. iModex is a youtube channel which was created in 2018. Make sure to join my Discord server. Discord. Exploits. Scripts. Powered by Create your own unique website with customizable templates. Get Started.
146,https://gadgets.ndtv.com/apps/news/microsoft-office-vulnerability-exploited-to-access-macos-devices-patrick-wardle-2275380,"PUBG Continental Series 3 Broadcasting channels, talent and more. Hello PUBG Esports fans! IT'S TIME. The PUBG Continental Series 3 (PCS3) is right around the corner and the exhilarating journey is about to begin!"
147,https://www.bloomberg.com/news/articles/2020-06-27/republicans-worry-trump-can-t-exploit-his-strength-on-economy,"The exploit has now been patched. In a blog post , the security researcher explained using several breaches and bugs that were present in Microsoft Office to inject the malicious code on macOS ..."
148,https://www.pubg.com/en-us/rules-of-conduct/,"Jun 27, 2020Republicans Worry Trump Can't Exploit His Strength on Economy By . Mario Parker ... A New York Times-Siena College poll of six battleground states released Thursday showed that 55% of registered ..."
149,https://samurai-gamers.com/playerunknowns-battlegrounds-pubg/useful-tips-tricks/,"Rules of Conduct. 1. General Rule. This Rules of Conduct regulate general matters that end users and company should comply with in relation to the services of PLAYERUNKNOWN'S BATTLEGROUNDS (hereinafter referred to as ""Game"") provided by PUBG CORPORATION (""PUBG"")."
150,https://www.newyorker.com/news/daily-comment/state-republican-leaders-are-rushing-to-exploit-donald-trumps-big-lie,"This page contains useful tips and tricks in PlayerUnknown's Battlegrounds (PUBG), including hidden mechanics, exploits, glitches, secrets, overlooked features and other information about the game that beginners and experienced may or may not know. Please note that we will continue to update this page as we discover more things in the game."
