num,url,text
1,https://www.privatecheatz.com/playerunknowns-battlegrounds-hack/,"Battlegrounds hacks will take you far, but a great drop will help kick it up a notch. There are a lot of things to remember when it comes to players PUBG, but knowing the map will always remain a top priority. Well, that and ensuring that you've got the best playerunkown's battlegrounds hack on your side."
2,https://battlelog.co/pubg-hacks/,
3,https://hackgame-tools.com/cheats/free-playerunknowns-battlegrounds-cheat-pubg-hack-wallhack-aimbot-pc/,"Playerunknown Battlegrounds Hacks - How we keep them safe. ... Always be on the lookout if hack providers are the real deal, and also never download free pubg cheats from a forum. ... An aimbot is a tool that allows you to shoot your enemies without having to aim manually. It helps you to shoot more accurately with less skill."
4,https://www.hack-cheat.org/gfx-tool-for-battlegrounds-new-v18,"DOWNLOAD Startup Pack. DOWNLOAD Last 2021 Script. Our PUBG hack are completely undetected so there is no risk to your account. If you're already familiar with cheats and such, then this won't be a very big surprise to you. PlayerUnknown's Battlegrounds is the newest rendition of shooter games to be considered, and it's much better than ..."
5,https://gamehakz.com/bullet-strike-battlegrounds-hack-tool-online/,"GFX Tool for BattleGrounds (NEW) V.18 tricks hints guides reviews promo codes easter eggs and more for android application. Avoid GFX Tool for BattleGrounds (NEW) V.18 hack cheats for your own safety, choose our tips and advices confirmed by pro players, testers and users like you. Ask a question or add answers, watch video tutorials & submit own opinion about this game/app."
6,https://lavicheats.com/playerunknowns-battlegrounds-hacks-pubg/,Evolving into the best Bullet Strike Battlegrounds gamer and accelerating the progress for winning the game is easy. Grab your endless cash and coins resources by using our free Bullet Strike Battlegrounds hack tool. Bullet Strike Battlegrounds Hack 2020 - Generate Unlimited Resources Today!
7,https://www.freefirepass27.com/,"Playerunknown Battlegrounds Hacks - Why we are Safest Cheats Provider Our developers at Lavicheats have designed metamorphic cheats with signature methods and custom, encrypted code to ensure that they stay undetectable to various anti-cheat software and tools, including BattleEye, VAC, and Xenuine."
8,https://www.cheat-god.com/cheats/free-playerunknowns-battlegrounds-cheat-pubg-hack-wallhack-aimbot-pc/,Visit this webpage to generate free ressources now with our new Online HACK! Free Fire Battlegrounds Hack Online Tool . Enter your game username and platform. Access Generator Generate ...
9,http://hackscommunity.com/freefire/,"FREE Download: PUBG Hack / Cheat. Wallhack, Aimbot and Radar Hack for Playerunknown's Battlegrounds. Undetected for Windows PC only."
10,https://www.iwantcheats.net/pubg-hacks/,Online Generator Tool. Free Fire Battlegrounds Hack Diamonds & Coins Generator. Account Details. Please enter your username for Free Fire Battlegrounds and choose your device. Username: Device: Proceed. Secure Connection. Please choose one of our proxy servers from the options below. London. Online. AES-256 Encryption.
11,https://apkpure.com/battlegrounds-advanced-graphics-tool-no-ban/jediarstudios.pubgmct,"Right now Playerunknown's Battlegrounds on Steam is the most popular game being played with over 450,000 daily players. 70% of the player base on PUBG is currently using hacks. Hack PUBG to win every round of PUBG that you play. The PUBG hacks are coded so well that you won't get banned and the anti-cheat can't detect you."
12,https://kow-foundry.com/hack/365cheats-com-free-fire-battlegrounds.php,"The description of Battlegrounds Advanced Graphics Tool [NO BAN] App BAGT is developed for people who wants to fully customize and optimize graphics and get you more Chicken Dinners. Ranging from midrange to flagship phones, this is the perfect tool for better gaming experience."
13,https://hackpubg2018free.blogspot.com/,"The Hack Tool for 365cheats.com Free Fire Battlegrounds also work for Android, iOS and Facebook which you decide on before using the generator and follow the instructions. It's clear that you have a lot of advantages in the game by using the 365cheats.com Free Fire Battlegrounds Tools."
14,https://justsmile-friend.blogspot.com/2019/07/free-fire-battlegrounds-hack-tool-4u.html,"cheat playerunknown's battlegrounds cheat PUBG hack PUBG hack PUBG free playerunknown's battlegrounds crack playerunknown's battlegrounds hack PUBG TOOL V 1.0 PUBG TOOL V 1.5 PUBG TOOL V 1.7 PUBG TOOL V 2.0 PUBG TOOL V 2.0 beta. Total Pageviews ""I do not have much time, so I need it to improve my ability."""
15,https://www.reddit.com/r/firebattlegrounds/,"Free Fire Battlegrounds Hack Tool 4U For Pro Players ﻿without paying a dime. free fire garena became a requirement have for many gamers as everyone is making an attempt to achieve a glance that is unique and superior to alternative players. However, buying them in-game has become a difficult subject as some players can't afford whereas some ..."
16,https://www.elitepvpers.com/forum/playerunknowns-battlegrounds/,"Working Free Fire Battlegrounds Hack diamonds and Coins - For Life free fire battlegrounds hack - gold, gems, coins - resources generator. For Widnows, Android and iOS doesn't require root or jailbreak.free fire battlegrounds Coins, Gems, Resources Hack Tool / Generator So if you're stuck somewhere, or just for fun, or to go beyond a level where you're struggling or to become one of the best ..."
17,https://play.google.com/store/apps/details?id=jediarstudios.pubgmct&hl=en_US&gl=US,"Download or share your PlayerUnknown's Battlegrounds hack at world's leading forum for all kind of PlayerUnknown's Battlegrounds hacks, cheats and aimbots. Here you will find a list of discussions in the PlayerUnknown's Battlegrounds forum at the Popular Games category. Sub-Forums : PlayerUnknown's Battlegrounds."
18,https://gunkinku.amebaownd.com/posts/7098040,"BAGT is developed for people who wants to fully customize and optimize graphics and get you more Chicken Dinners. Ranging from midrange to flagship phones, this is the perfect tool for better gaming experience. 1. If you changed ANYTHING in the in-game graphics settings, please close the game and re-apply your setting from BAGT before playing. 2."
19,https://advancpesens.blogspot.com/2021/06/roblox-elemental-battlegrounds-hack.html,"publish Date: 21 Dec, 2017. resume: PLAYERUNKNOWN'S BATTLEGROUNDS is a battle royale shooter that pits 100 players against each other in a struggle for survival. Gather supplies and outwit your opponents to become the last person standing. PLAYERUNKNOWN'S BATTLEGROUNDS hack tool zip password. PLAYERUNKNOWN'S BATTLEGROUNDS hack xmodgames iphone"
20,https://cheatallgame.com/free-fire-battlegrounds-hack-2019-the-best-hack-tool-to-get-free-diamonds/,"roblox elemental battlegrounds hack diamonds. Roblox Elemental Battlegrounds Hack Diamonds ... If you have planned to avail the free robux hack tool for the game play, you can receive it by online. After you have opened the site that provides the free robux, you want to give the necessary details that it asks. ..."
21,https://in.pinterest.com/pin/762445411898947713/,"Free Fire Battlegrounds Hack 2019, The Best Hack Tool To Get Free Diamonds. Action November 22, 2019. 0 258 . Free Fire Battlegrounds Hack 2019, The Best Hack Tool To Get Free Diamonds The gaming industry has been growing at a rapid pace. The likes of the players get people to employ various cheats and hack to rise up on the leaderboard faster."
22,https://gurugamer.com/mobile-games/free-fire-battlegrounds-hack-2020-12124,"Sep 21, 2019 - Free Fire Battlegrounds Hack Online Tool Free Fire Battlegrounds Hack Online Tool Proof Free Access Free Fire Battlegrounds Online Hack Tool Generator 2019 * Max Free Credits Amount You Can Add To Your Account or Generate Up To 999999999 Per Daily Limit..."
23,https://hackofgame.com/free-fire-battlegrounds-hack-2019-get-free-unlimited-diamonds-to-your-account/,The latest version of free fire battlegrounds hack online tool in 2020 is Free Fire MOD APK v1.52. which is comparative to Android 4.0 and higher. Here is the details instruction of how to set up Free fire battlegrounds hack 2020 on your phone: Download the Free Fire MOD APK v1.50. and the OBB file to your phone.
24,https://www.pinterest.com/garenafreefirehack0026/free-fire-battlegrounds-hack/,"Free Fire Battlegrounds Hack is very simple to use. All you need to do to get it started is to click on it. Below are the steps you need to follow to make it work for you: Click on the 'ONLINE HACK V1', or 'ONLINE HACK V2', or 'ONLINE HACK V3'; visit the website hack and submit all the required information, the click 'generate'."
25,https://cheatallgame.com/tiny-battleground-hack-2019-free-crystals/,"Jul 13, 2020 - Free Fire Battlegrounds Hack. See more ideas about hacks, cheat online, tool hacks."
26,https://hackactiongames.com/,Tiny Battleground Hack Tool is easy to use and can be used in simple steps. It is definitely not Rocket science and nothing in comparison what gamers are subjected to on an everyday basis. There is no installation required for any kind of software on your system. You just need to follow simple steps to get the Hack working.
27,https://freefirehacktool.club/,"Game Hack Tool. 12 October, 2020 / By Jadon Rogahn. Legacy Of Discord Furious Wings Hack Cheats Unlimited Diamonds. The rising fame of Legacy of Discord Furious Wings game among Android and iOS players have caught the attention. Game Hack Tool. 11 October, 2020 / By Jadon Rogahn. Mutants Genetic Gladiators Hack Cheats Unlimited Gold."
28,https://friv2games.org/zombie-battleground-hack-tool-online-premium-100-working-cheat-999k-gold/,This is the latest and 2021 updated Garena Free Fire Hack tool online. No Software or App Download To Use Free Fire Generator. We have successfully launched the Garena Free Fire Diamonds Generator on an online server. We also can make software or app for your compatible devices. But software or app is not a good thing for your device they can ...
29,https://www.technovimal.in/hack-battlegrounds-mobile-india-pubg.html,Our team is so pleased to declare that the Zombie Battleground hack tool is finally prepared after putting an enormous effort in the creation of our 100% working game hack tool. Zombie Battleground Hack 2020 - Obtain Unlimited Resources Now! It usually requires a lot of time to get a victory in the Zombie Battleground.
30,https://www.centerffs.org/sites/default/files/webform/internships/coverletters/10por-garena-free-fire-hack-diamonds-generator-Ur1D.pdf,"PUBG Hack is nothing but implementing an additional script to the main Battlegrounds Mobile India (PUBG) mobile game so that players can get a few extra things for the game for free. With this Battlegrounds Mobile India (PUBG) Hack, players will get a list of useful things such as AimBot, No Recoil, Speed Hack, Wall Hack, and more."
